status_id	created_at	text	retweet_count	favorite_count	is_retweet	retweet_created_at
1354553539444531208	Wed Jan 27 22:15:04 +0000 2021	RT @S_Evangelina: Have you seen an image of Malcolm X baptizing Tupac? Or of Justice Ruth Bader Ginsburg shooting dice in an alleyway? I ex…	24	0	1	Wed Jan 27 19:56:23 +0000 2021
1354549813258432512	Wed Jan 27 22:00:16 +0000 2021	The 2021 Cannes Film Festival, which was canceled last year, has been postponed as expected because of the coronavi… https://t.co/5bTATd1lbf	41	128	0	
1354544731456495617	Wed Jan 27 21:40:04 +0000 2021	Toxic chemicals on the very gear meant to protect the lives of firefighters could instead be making them gravely il… https://t.co/jSdLhVDq36	77	267	0	
1354543985008762881	Wed Jan 27 21:37:06 +0000 2021	President Biden on Wednesday signed a series of executive orders aimed at combatting climate change. The orders spe… https://t.co/PtsIZfmo55	171	895	0	
1354542266795356162	Wed Jan 27 21:30:17 +0000 2021	President Biden’s nominee to lead the Department of Energy would control powerful levers to promote clean-energy te… https://t.co/9AkrMbgr0e	51	260	0	
1354539955960348676	Wed Jan 27 21:21:06 +0000 2021	Leon Black said he would step down as the CEO of Apollo Global Management after it was revealed he paid $158 millio… https://t.co/NaOplqsYmg	95	227	0	
1354537015719710721	Wed Jan 27 21:09:25 +0000 2021	Wall Street suffered its sharpest daily decline in months on Wednesday, with the S&amp;P 500 dropping about 2.6%.  https://t.co/8Ugc3tnxdk	57	256	0	
1354534738585903104	Wed Jan 27 21:00:22 +0000 2021	In her first year as the Queens district attorney, Melinda Katz established a review unit for potential wrongful co… https://t.co/GfY8RgATlm	44	234	0	
1354532148288610305	Wed Jan 27 20:50:04 +0000 2021	Europe’s coronavirus vaccination woes have snowballed into a full-blown crisis. https://t.co/UvXj0Rvti2	49	161	0	
1354529640254201867	Wed Jan 27 20:40:06 +0000 2021	On his first full day as U.S. secretary of state, Antony Blinken repeated his pledge to rebuild trust among State D… https://t.co/toUcIG3oKc	106	687	0	
1354527179967705089	Wed Jan 27 20:30:20 +0000 2021	See the Covid-19 risk in your county and a guide for daily life near you https://t.co/wcRgrD0J4F	50	178	0	
1354524598738579457	Wed Jan 27 20:20:04 +0000 2021	President Biden has proposed a path to citizenship for nearly 11 million undocumented people — part of a sweeping p… https://t.co/LbhBmCKz4x	92	558	0	
1354522076804214784	Wed Jan 27 20:10:03 +0000 2021	We asked Ricky Gervais, Nell Scovell, Bruce Vilanch, Jordan Horowitz and Peter Mehlman what they would change about… https://t.co/RhttXQygH0	33	225	0	
1354522074715463688	Wed Jan 27 20:10:03 +0000 2021	RT @NYTSports: Suddenly, I was writing obituaries and editing tributes for people I had cracked jokes with or asked for a few minutes to c…	13	0	1	Wed Jan 27 17:43:45 +0000 2021
1354519633475362822	Wed Jan 27 20:00:21 +0000 2021	Since few people actually read the privacy policy before downloading an app, Apple has required apps to include qui… https://t.co/rRwVMc6WW0	35	180	0	
1354517058210426883	Wed Jan 27 19:50:07 +0000 2021	When expectations of the Oscars ceremony set in, so did bloat. https://t.co/23jvykiEXK	33	197	0	
1354515782693220354	Wed Jan 27 19:45:02 +0000 2021	Small traders are teaming up against big Wall Street institutions, as their Reddit-fueled frenzy over GameStop has… https://t.co/tV5hGDJFCR	421	1838	0	
1354514537026826246	Wed Jan 27 19:40:05 +0000 2021	Donald Trump's supporters see his second impeachment, a first for an American president, as the culmination of year… https://t.co/dmsS5yGPJF	55	274	0	
1354511878140162048	Wed Jan 27 19:29:32 +0000 2021	Nearly 140 police officers were injured during the Jan. 6 pro-Trump mob attack on the Capitol, including officers w… https://t.co/B4d9r3jXwU	529	962	0	
1354509517963276289	Wed Jan 27 19:20:09 +0000 2021	A man who was known as a far-right Twitter troll was charged with spreading disinformation through memes that trick… https://t.co/wBzFOvP4EN	193	510	0	
1354507243832672261	Wed Jan 27 19:11:07 +0000 2021	The U.S. will face heightened threats for weeks from violent extremists emboldened by the assault on the Capitol, a… https://t.co/hUrp5ZrRnR	146	384	0	
1354501958409875459	Wed Jan 27 18:50:06 +0000 2021	Cliff Levy, who has led The New York Times’s metro desk since 2018, will become a deputy managing editor advising t… https://t.co/Cg0HkyyTyu	24	151	0	
1354501270057463815	Wed Jan 27 18:47:22 +0000 2021	RT @aoscott: Some back-of-the-envelope Oscar thoughts https://t.co/LC3bb5rWwk	17	0	1	Wed Jan 27 15:09:33 +0000 2021
1354500697589506052	Wed Jan 27 18:45:06 +0000 2021	RT @kimseverson: So will a Biden @USDA be different? Maybe, but first the agency needs to tackle the hunger crisis. My report. https://t.co…	99	0	1	Tue Jan 26 20:39:06 +0000 2021
1354499432440598532	Wed Jan 27 18:40:04 +0000 2021	President Biden has already installed roughly 1,000 high-level political appointees. His speedy grasp of power incl… https://t.co/kZVY3L0GFT	536	2933	0	
1354497176584523779	Wed Jan 27 18:31:06 +0000 2021	Indoor dining restrictions are set to be lifted in several areas across New York, Gov. Andrew Cuomo announced on We… https://t.co/gOGa3wqrvh	37	157	0	
1354491878058635277	Wed Jan 27 18:10:03 +0000 2021	RT @nytimesbooks: Here are 13 new books to watch for in February https://t.co/U4W7Kqf0Pm	61	0	1	Wed Jan 27 15:15:09 +0000 2021
1354490642232193026	Wed Jan 27 18:05:08 +0000 2021	Walgreens has named Rosalind Brewer as its next CEO, making the Starbucks executive the only Black woman to current… https://t.co/BQHYpx0JHN	157	766	0	
1354489387741024260	Wed Jan 27 18:00:09 +0000 2021	The reuse of scarce protective equipment to fight Covid-19 has helped spread drug-resistant bacteria and fungi. The… https://t.co/fg4Rb4Xmiz	94	180	0	
1354486858781220864	Wed Jan 27 17:50:06 +0000 2021	RT @kimmelman: My latest column, on a plan to help fix recycling in America.  https://t.co/cGbdBFnGGc	48	0	1	Wed Jan 27 12:32:58 +0000 2021
1354485608203374593	Wed Jan 27 17:45:08 +0000 2021	In Opinion“I learned that the man I had believed was a savior who did all he could to rescue Jews during World Wa… https://t.co/aHmrlAg2gt	113	476	0	
1354485480285499393	Wed Jan 27 17:44:38 +0000 2021	John Kerry, President Biden’s climate change envoy, warned business leaders that time was running out to reduce emi… https://t.co/ApfT0DQRXz	118	650	0	
1354483075816837124	Wed Jan 27 17:35:05 +0000 2021	RT @nytopinion: South Dakota’s Covid-19 death rate is one of the worst in the United States — but Gov. Kristi Noem, who imposed almost no r…	52	0	1	Wed Jan 27 11:16:20 +0000 2021
1354482081758388236	Wed Jan 27 17:31:08 +0000 2021	Britain is continuing to tighten its international travel restrictions: British citizens arriving home from 22 high… https://t.co/W9OveujGHS	52	246	0	
1354480555203719169	Wed Jan 27 17:25:04 +0000 2021	Amanda Gorman: National Youth Poet Laureate, IMG model, Super Bowl performer. https://t.co/AKG39u0SRO	153	1539	0	
1354479553188651008	Wed Jan 27 17:21:05 +0000 2021	Was Oumuamua, the bizarre cigar-shaped object that zoomed through our solar system in 2017, a piece of alien techno… https://t.co/hTzOwEucg2	376	1944	0	
1354478965549899782	Wed Jan 27 17:18:45 +0000 2021	RT @S_Evangelina: Amanda Gorman is staying bookedT and busy https://t.co/dNmsgM00Co	75	0	1	Wed Jan 27 17:10:38 +0000 2021
1354474247666720771	Wed Jan 27 17:00:00 +0000 2021	RT @sapna: MyPillow has been dropped by retailers &amp; other companies in the past month as its CEO Mike Lindell has promoted conspiracy theor…	40	0	1	Wed Jan 27 14:36:14 +0000 2021
1354474227047522306	Wed Jan 27 16:59:55 +0000 2021	Today’s Great Read: Every year, tens of millions of Americans collectively lose billions of dollars to scam callers… https://t.co/vOJI9PDRYe	23	103	0	
1354471745114304516	Wed Jan 27 16:50:03 +0000 2021	Many of the Capitol rioters hopped between conspiracy theories on a path to believing false claims of election frau… https://t.co/h8yhoLtZ5N	118	398	0	
1354469995506503687	Wed Jan 27 16:43:06 +0000 2021	In just the last half-century, oceanic sharks and rays have declined more than 70%, mainly because of overfishing,… https://t.co/K3wVmcIde8	344	816	0	
1354467473479905280	Wed Jan 27 16:33:05 +0000 2021	President Biden’s top coronavirus advisers — including Dr. Anthony Fauci and Dr. Rochelle Walensky, the new directo… https://t.co/Gq3mlBswiX	103	717	0	
1354466835433988096	Wed Jan 27 16:30:33 +0000 2021	County-level risk assessments will be updated regularly along with the rest of The Times’s coronavirus tracking pro… https://t.co/wmtzmAXALz	42	112	0	
1354466738428125184	Wed Jan 27 16:30:09 +0000 2021	Risk levels have shifted over time. The change in risk levels from the fall to winter was stark as cases peaked.… https://t.co/hcgIM8b8qS	55	146	0	
1354466491568156672	Wed Jan 27 16:29:11 +0000 2021	Here are some examples of the detailed local pages and risk assessments for each area. Many of the biggest U.S. cit… https://t.co/vAJUHVderA	26	59	0	
1354466071080820739	Wed Jan 27 16:27:30 +0000 2021	To help you understand how to manage your Covid-19 risk, we partnered with public health experts at @ResolveTSL to… https://t.co/PX8sNmp9Yr	24	65	0	
1354465882148372482	Wed Jan 27 16:26:45 +0000 2021	The Times has published detailed pages and risk assessments for nearly every county in the U.S. This tool can help… https://t.co/U65z2vh9rh	51	123	0	
1354465457407987712	Wed Jan 27 16:25:04 +0000 2021	In a majority of U.S. counties right now, residents are at an extremely high risk of getting Covid-19, an analysis… https://t.co/JS7mmyBuEC	698	1299	0	
1354464301109702656	Wed Jan 27 16:20:28 +0000 2021	President Biden's goal to take on climate change could mean big changes for America’s role in the world. It would r… https://t.co/A5wQXZ0lC7	68	411	0	
1354464265068032000	Wed Jan 27 16:20:20 +0000 2021	RT @nytclimate: Biggest priority for 2021, says John Kerry: make the most of the Glasgow climate conference to bring governments and busine…	29	0	1	Wed Jan 27 16:19:47 +0000 2021
1354462948996091904	Wed Jan 27 16:15:06 +0000 2021	President Biden on Wednesday will sign executive orders elevating climate change at every level of the federal gove… https://t.co/6SeZtfAaaT	443	2556	0	
1354462887994130437	Wed Jan 27 16:14:51 +0000 2021	RT @nytclimate: We have a huge methane problem, folks, says John Kerry. We have some other alternatives and politics has turned against…	17	0	1	Wed Jan 27 16:06:35 +0000 2021
1354461139413790724	Wed Jan 27 16:07:54 +0000 2021	A member of an anti-government group accused of plotting to kidnap Gov. Gretchen Whitmer of Michigan pleaded guilty… https://t.co/BCTxPcJBde	483	1487	0	
1354459174026027009	Wed Jan 27 16:00:06 +0000 2021	Nothing has been normal about the past year, including the movies. @AOScott writes about why the academy should use… https://t.co/F6oehRxyPX	24	138	0	
1354457811200176136	Wed Jan 27 15:54:41 +0000 2021	RT @nytclimate: it's going to be the most massive mobilization of government around this issue in history, said John Kerry, but There's…	21	0	1	Wed Jan 27 15:51:46 +0000 2021
1354456659142316035	Wed Jan 27 15:50:06 +0000 2021	RT @LFFriedman: Big day ahead on the climate front... In Sweeping Actions on Climate, Biden to ‘Pause’ Oil and Gas Leasing https://t.co/Up…	62	0	1	Wed Jan 27 14:04:41 +0000 2021
1354454349364273155	Wed Jan 27 15:40:56 +0000 2021	RT @RBlumenstein: Senator John Kerry (@ClimateEnvoy) opened the panel noting that the U.S. rejoined the Paris Climate Agreement with humili…	17	0	1	Wed Jan 27 15:34:05 +0000 2021
1354454157432860681	Wed Jan 27 15:40:10 +0000 2021	Rep. Marjorie Taylor Greene, a recently elected Georgia Republican, repeatedly endorsed executing top Democratic po… https://t.co/KwqTiqP8Ls	520	1526	0	
1354451641802620935	Wed Jan 27 15:30:10 +0000 2021	News Analysis: The battle lines are forming in President Biden’s climate push, with unlikely allies backing him and… https://t.co/6n2rUOXlwz	56	425	0	
1354451005090504705	Wed Jan 27 15:27:38 +0000 2021	RT @nytclimate: John Kerry, President Biden’s climate envoy, is speaking at the virtual World Economic Forum about the U.S. agenda to curb…	44	0	1	Wed Jan 27 15:26:59 +0000 2021
1354449376949768196	Wed Jan 27 15:21:10 +0000 2021	RT @RBlumenstein: What do Senator John Kerry (@ClimateEnvoy) and other business leaders from @Shell, @DSM, and @COP26 have to say about mob…	28	0	1	Wed Jan 27 15:17:04 +0000 2021
1354447857609281540	Wed Jan 27 15:15:08 +0000 2021	Why is Wall Street obsessed with GameStop, the video game chain that until recently was known for middling performa… https://t.co/cz8Mg4TFfh	404	1665	0	
1354444076045766665	Wed Jan 27 15:00:06 +0000 2021	The French drugmaker Sanofi said it would help produce more than 100 million doses of the Pfizer-BioNTech coronavir… https://t.co/L3qAR00CrL	91	467	0	
1354440283295985671	Wed Jan 27 14:45:02 +0000 2021	RT @HirokoTabuchi: More firefighters die of cancer than of being burned in a fire. Now, they want their union to take stronger action to pr…	170	0	1	Tue Jan 26 19:11:49 +0000 2021
1354436517557641221	Wed Jan 27 14:30:04 +0000 2021	Slovenia’s populist government has replaced the directors at major museums and ended the leases of many arts organi… https://t.co/UkpVkzH11t	73	255	0	
1354433115465412610	Wed Jan 27 14:16:33 +0000 2021	See the Covid-19 risk in your area and learn how to lower your own risk with our interactive U.S. county map.https://t.co/pt7u7QSlXG	116	307	0	
1354428989364961282	Wed Jan 27 14:00:09 +0000 2021	Moscow’s mayor abruptly lifted most coronavirus restrictions in the city on Wednesday, declaring the pandemic was e… https://t.co/M4S15lgH6N	46	173	0	
1354425194631352324	Wed Jan 27 13:45:05 +0000 2021	RT @andrewrsorkin: Today’s @DealBook is out: Inside the GameStop $GME mania. Did retail investors best a short seller? Where are the regula…	63	0	1	Wed Jan 27 13:10:47 +0000 2021
1354421451084984328	Wed Jan 27 13:30:12 +0000 2021	The CEO of MyPillow, Mike Lindell, blamed “cancel culture” when major retailers dropped his products. His company h… https://t.co/TCFPeG7p6d	166	1246	0	
1354413897315479553	Wed Jan 27 13:00:11 +0000 2021	The number of new coronavirus cases in the U.S. is falling. But as new virus variants spread, will the downward tre… https://t.co/VkSXWxhHO6	46	253	0	
1354410347537559552	Wed Jan 27 12:46:05 +0000 2021	RT @VVFriedman: Today Kim Jones takes on the Lagerfeld mantle at @Fendi #couture. Here's his plan - https://t.co/MjdJVv5wtX	34	0	1	Wed Jan 27 12:37:15 +0000 2021
1354406318547886081	Wed Jan 27 12:30:04 +0000 2021	Tens of thousands of farmers, many driving tractors, took to the streets of New Delhi on Tuesday. They have been de… https://t.co/fKMQ9IAJjV	86	452	0	
1354400531524055043	Wed Jan 27 12:07:04 +0000 2021	Know my name, and remember it. When can we put the tragedy to an end?” A song by Tan Weiwei, a pop star, about r… https://t.co/qs9Me1T8d5	92	553	0	
1354395001694859269	Wed Jan 27 11:45:06 +0000 2021	RT @_StephenCastle: It's a nightmare - struggling with post Brexit paperwork truckers stay away from British ports that prepared for grid…	30	0	1	Wed Jan 27 10:45:55 +0000 2021
1354390924546240512	Wed Jan 27 11:28:54 +0000 2021	Britain and the EU are fighting over scarce coronavirus vaccines, opening a nationalist competition that could pois… https://t.co/S2kWaV46JU	76	241	0	
1354387447635980288	Wed Jan 27 11:15:05 +0000 2021	RT @CeylanWrites: The United States now requires a negative coronavirus test for all arriving international travelers, which has hotels add…	55	0	1	Wed Jan 27 05:40:20 +0000 2021
1354383704399994882	Wed Jan 27 11:00:13 +0000 2021	The Biden administration will restore diplomatic relations with the Palestinian Authority, more than two years afte… https://t.co/heXT9uYYlx	259	1481	0	
1354379899948179457	Wed Jan 27 10:45:05 +0000 2021	RT @vwang3: More than 200,000 Hong Kong residents live in often-dilapidated tenements that are just waiting to be Covid hotspots. How the c…	81	0	1	Tue Jan 26 14:51:48 +0000 2021
1354376132481724422	Wed Jan 27 10:30:07 +0000 2021	Despite predictions of post-Brexit gridlock, some of Britain’s ports are nearly empty. Truckers, fearful of the mou… https://t.co/KcSk0n5wLZ	61	229	0	
1354373605027696641	Wed Jan 27 10:20:05 +0000 2021	RT @MatinaStevis: The vaccine wars are here and they're ugly.How the AstraZeneca debacle is pitting EU vs UK, marking a nasty turn in the…	101	0	1	Wed Jan 27 07:52:50 +0000 2021
1354368572794032128	Wed Jan 27 10:00:05 +0000 2021	Two people were found dead in a medical office in Austin, Texas, late Tuesday following a hostage standoff that end… https://t.co/qalrRLbhb5	57	196	0	
1354353491926544386	Wed Jan 27 09:00:09 +0000 2021	The Italian prime minister resigned on Tuesday, triggering the collapse of the government. Italy's return to a fami… https://t.co/o26Z9P4tMg	200	443	0	
1354345930191990784	Wed Jan 27 08:30:06 +0000 2021	Here's a look at some of the highlights worth watching from late-night TV. https://t.co/KayvVomFdS	32	230	0	
1354338396710326275	Wed Jan 27 08:00:10 +0000 2021	Six nongovernmental organizations, including Human Rights Watch and Amnesty International, put the French state on… https://t.co/mL5BjzJ080	281	802	0	
1354323302928560129	Wed Jan 27 07:00:12 +0000 2021	The European Union, stung by its slow progress on coronavirus vaccinations, threatened this week to tighten rules o… https://t.co/hZFqvV9GGr	53	193	0	
1354308182613618691	Wed Jan 27 06:00:07 +0000 2021	Christina Crosby, a feminist scholar whose memoir, A Body, Undone, was a significant text in disability studies a… https://t.co/xRwrqfsjUe	66	546	0	
1354304396146974721	Wed Jan 27 05:45:04 +0000 2021	The actor and comedian Cheech Marin will open an art museum and academic center in Riverside, California, this fall… https://t.co/SiW9w2KzzF	701	4896	0	
1354300617427218440	Wed Jan 27 05:30:03 +0000 2021	Donald Trump valued cabinet secretaries he saw as deal makers. President Biden has chosen policymakers, while also… https://t.co/HkTxagXe2t	137	1231	0	
1354296851558752257	Wed Jan 27 05:15:05 +0000 2021	A New York City police officer was hospitalized in stable condition on Tuesday night after being shot in the lower… https://t.co/k9u6GQrNTE	32	210	0	
1354293093722447872	Wed Jan 27 05:00:09 +0000 2021	An emergency worker in Florida was arrested this week in connection with the theft of coronavirus vaccine doses, ju… https://t.co/0VM2BTqomc	209	603	0	
1354288042551472135	Wed Jan 27 04:40:05 +0000 2021	What did Jeffrey Epstein do to earn hundreds of millions of dollars from a handful of wealthy clients like the priv… https://t.co/Vy5Lp7C9IS	378	1217	0	
1354283012062588929	Wed Jan 27 04:20:06 +0000 2021	A California man was arrested and charged with sending threatening text messages to relatives of George Stephanopou… https://t.co/U4A9rqKsIY	193	610	0	
1354277982458802180	Wed Jan 27 04:00:06 +0000 2021	Mayor Nan Whaley of Dayton, Ohio, a 45-year-old progressive Democrat, is considering a 2022 campaign for governor o… https://t.co/W7FvL7NmM2	215	1727	0	
1354274184378130442	Wed Jan 27 03:45:01 +0000 2021	The acting chief of the Capitol Police told lawmakers on Tuesday that the department was unprepared for the violenc… https://t.co/sr85AOsgRK	86	302	0	
1354270432585801728	Wed Jan 27 03:30:06 +0000 2021	Oklahoma has spent months trying to unload a stockpile of hydroxychloroquine — an antimalarial drug touted by Donal… https://t.co/Pwa9LJi8vt	580	1821	0	
1354266767342903298	Wed Jan 27 03:15:33 +0000 2021	Only five Republicans joined Democrats in a vote on Tuesday to go forward with Donald Trump's impeachment trial, fa… https://t.co/8aYhjAXjsi	130	489	0	
1354262922869035009	Wed Jan 27 03:00:16 +0000 2021	Hong Kong has long been one of the most unequal places on Earth. For the poorest residents, crammed into flats so s… https://t.co/f8VvuwF6Tp	85	275	0	
1354259093024858115	Wed Jan 27 02:45:03 +0000 2021	President Biden said on Tuesday the amount of coronavirus vaccines reaching the states would rise next week and a d… https://t.co/VR4juoA2bA	108	642	0	
1354255328817328128	Wed Jan 27 02:30:05 +0000 2021	A Canadian couple was fined after they were charged with violating coronavirus restrictions when they traveled to a… https://t.co/548jWIYGXj	79	399	0	
1354251563171250179	Wed Jan 27 02:15:08 +0000 2021	News Analysis: President Biden is moving rapidly to address global warming, with unlikely allies backing him and hu… https://t.co/YPxpogft0n	105	943	0	
1354250283258441729	Wed Jan 27 02:10:02 +0000 2021	RT @NYTNational: It’s been one year since Kobe Bryant, his daughter Gianna and seven others died in a helicopter crash. Here's a look back,…	33	0	1	Wed Jan 27 01:02:49 +0000 2021
1354249167598542854	Wed Jan 27 02:05:36 +0000 2021	Update: Senator Patrick Leahy, Democrat of Vermont and the longest-serving senator, returned home after he was brie… https://t.co/v7Eqs9ZtD4	78	514	0	
1354247785260994560	Wed Jan 27 02:00:07 +0000 2021	The nine House members — six men and three women — who will serve as the prosecution team in Donald Trump's Senate… https://t.co/ZRpIdg7HSB	60	301	0	
1354244006012715009	Wed Jan 27 01:45:06 +0000 2021	Jennifer King is the first Black woman to become a full-time coach in the NFL after she was promoted by The Washing… https://t.co/RUISLqFGYI	162	1040	0	
1354240236675608576	Wed Jan 27 01:30:07 +0000 2021	A Wisconsin pharmacist accused of intentionally sabotaging hundreds of Covid-19 vaccine doses will plead guilty to… https://t.co/7hb76VqCjc	234	848	0	
1354236450821333003	Wed Jan 27 01:15:05 +0000 2021	A Republican state lawmaker in Georgia was kicked out of the House chamber after refusing to be tested for Covid-19… https://t.co/kieMMzMSvw	101	550	0	
1354232713121771521	Wed Jan 27 01:00:13 +0000 2021	RT @jwherrman: media people: remember those meetings with facebook five years ago about doing more video, doing live content, etc? the susp…	28	0	1	Tue Jan 26 19:25:23 +0000 2021
1354228911983505409	Wed Jan 27 00:45:07 +0000 2021	Lloyd Austin’s first act as the new U.S. secretary of defense was ordering a review of how the Pentagon has handled… https://t.co/E5eSsu13Pk	216	1362	0	
1354225131204321284	Wed Jan 27 00:30:06 +0000 2021	The world surpassed 100 million known coronavirus cases. Experts say that 100 million most likely underestimates th… https://t.co/OzhMP1cinV	144	353	0	
1354221354338414593	Wed Jan 27 00:15:05 +0000 2021	Investigators are trying to determine how closely members of the Proud Boys communicated during the Capitol riot an… https://t.co/psSzptaMsz	172	589	0	
1354217576679829505	Wed Jan 27 00:00:05 +0000 2021	The State Department is urging Americans to avoid traveling abroad for nonessential reasons, warning that if you ca… https://t.co/mNMe752WXd	151	426	0	
1354212559881175042	Tue Jan 26 23:40:08 +0000 2021	Senator Patrick Leahy, Democrat of Vermont and the longest-serving senator, was hospitalized early Tuesday evening… https://t.co/TnNXtilKVD	800	2416	0	
1354210028987805699	Tue Jan 26 23:30:05 +0000 2021	Law enforcement officials were stunned when former President Donald Trump commuted the life sentence of a man convi… https://t.co/sNPhZnUsKp	254	439	0	
1354207908553084935	Tue Jan 26 23:21:40 +0000 2021	Read our obituary for Kobe Bryant, who died one year ago today. https://t.co/QUPdZUKo2m	44	281	0	
1354207499835072513	Tue Jan 26 23:20:02 +0000 2021	On the anniversary of Kobe Bryant's death, the widow of another famed athlete reflects on her grief and offers her… https://t.co/seC2K282Ag	103	723	0	
1354205666689359873	Tue Jan 26 23:12:45 +0000 2021	President Biden also signed orders that make it the federal government’s policy to “condemn and denounce” discrimin… https://t.co/4iLNPxV9tf	75	571	0	
1354205118552485888	Tue Jan 26 23:10:34 +0000 2021	President Biden signed executive orders on Tuesday to end Justice Department contracts with private prisons and inc… https://t.co/0WtakouqIC	235	1640	0	
1354202539747663873	Tue Jan 26 23:00:19 +0000 2021	With just a little effort, this creamy vegan pasta delivers a ton of texture and flavor. https://t.co/lWYr6GxnWW	36	236	0	
1354201208777568257	Tue Jan 26 22:55:02 +0000 2021	RT @katie_robertson: In an interview, Marty Baron says the biggest challenge facing media is the “level of conspiracy thinking that has bec…	146	0	1	Tue Jan 26 22:33:27 +0000 2021
1354199956492578820	Tue Jan 26 22:50:04 +0000 2021	The Capitol riot investigation will slow down as officials shift from identifying and arresting individuals to more… https://t.co/DQrXyfFi70	111	374	0	
1354197532025495556	Tue Jan 26 22:40:26 +0000 2021	Vice President Kamala Harris on Tuesday afternoon received her second dose of the Moderna vaccine in a televised ap… https://t.co/pWJJe5rgOw	255	2772	0	
1354192407957565442	Tue Jan 26 22:20:04 +0000 2021	Travelers flying into the U.S. from any other country must present proof of a negative test for the coronavirus beg… https://t.co/HKIxX52x0t	63	196	0	
1354190948696256513	Tue Jan 26 22:14:16 +0000 2021	A federal judge in Texas has temporarily blocked the Biden administration’s 100-day pause on deportations. https://t.co/tX2A1q6neE	73	218	0	
1354189937483145219	Tue Jan 26 22:10:15 +0000 2021	This photographer took the photo of Senator Bernie Sanders (and his mittens) on Inauguration Day that launched a th… https://t.co/Crd2hG33ME	266	2058	0	
1354187400617013248	Tue Jan 26 22:00:10 +0000 2021	The Senate confirmed Antony Blinken as secretary of state. Here are five Trump administration policies that Blinken… https://t.co/eWQI4isZpi	69	353	0	
