status_id	created_at	text	retweet_count	favorite_count	is_retweet	retweet_created_at
1351944178352222212	Wed Jan 20 17:26:24 +0000 2021	President Joe Biden was sworn in by Chief Justice John Roberts Jr., completing the process 11 minutes before the au… https://t.co/AYxv6Z9NU2	860	5182	0	
1351943859383783459	Wed Jan 20 17:25:08 +0000 2021	President Biden and Jill Biden arrive on the inauguration stage before Biden was sworn in as the 46th president of… https://t.co/txlDWO7xoN	97	1354	0	
1351943696065982466	Wed Jan 20 17:24:29 +0000 2021	At 22 years old, Amanda Gorman is the youngest inaugural poet in U.S. history. She joined a small group of poets wh… https://t.co/nELcLhRv4U	3056	18456	0	
1351942370351316999	Wed Jan 20 17:19:13 +0000 2021	The home page of The New York Times on Jan. 20, 2021, at 12 p.m. Eastern. https://t.co/cdrQdroTMg	1846	10527	0	
1351941322479972352	Wed Jan 20 17:15:03 +0000 2021	As a child, Joe Biden wrestled with words, grappling with a boyhood stutter.Now the 46th president of the United… https://t.co/CNGs4epSwz	307	2975	0	
1351940026649767936	Wed Jan 20 17:09:54 +0000 2021	Vice President Kamala Harris was sworn in as the first Black woman and first Indian-American to hold the office. He… https://t.co/T7YKUiZ60r	1276	6070	0	
1351937406996541440	Wed Jan 20 16:59:30 +0000 2021	Breaking News: Joe Biden is sworn in as the 46th president. With his hand on a five-inch-thick Bible that has been… https://t.co/rNKEGycgT2	1688	11591	0	
1351937270648078338	Wed Jan 20 16:58:57 +0000 2021	President Joe Biden is giving his first speech after being sworn in. Watch live: https://t.co/9nIZo4zkrT https://t.co/Hm0uE2U42N	387	3265	0	
1351936202241417225	Wed Jan 20 16:54:43 +0000 2021	Breaking News: Kamala Harris became the first woman — and the first woman of color — sworn in as vice president of… https://t.co/wB5LiNXNEV	2288	14869	0	
1351935101693816836	Wed Jan 20 16:50:20 +0000 2021	Breaking News: Joseph R. Biden Jr. was sworn in as the 46th president of the United States, with a promise to seek… https://t.co/4nTpiXPOQt	616	3647	0	
1351934109690556417	Wed Jan 20 16:46:24 +0000 2021	Kamala Harris became the first woman — and the first woman of color — sworn in as vice president.The history-maki… https://t.co/XqmtJMmt67	668	2968	0	
1351933791531577344	Wed Jan 20 16:45:08 +0000 2021	Amanda Gorman, 22, is the youngest inaugural poet ever in the U.S. She finished writing her poem late into the nigh… https://t.co/JjfW4IKBp2	3240	12651	0	
1351933416338579457	Wed Jan 20 16:43:38 +0000 2021	In the hour before his term expired, President Trump granted a last-minute pardon to Al Pirro, the ex-husband of Je… https://t.co/iv2H7iNL0x	71	242	0	
1351932072231903232	Wed Jan 20 16:38:18 +0000 2021	This is not the first time that Lady Gaga and Joe Biden have shared the spotlight. The singer’s ties to Biden date… https://t.co/pqAsEgOZQ4	818	6593	0	
1351931272910823424	Wed Jan 20 16:35:07 +0000 2021	To prevent the spread of the coronavirus, only about 1,000 guests will be present at the Capitol for President-elec… https://t.co/p8kaKV2UjQ	55	543	0	
1351930378098003971	Wed Jan 20 16:31:34 +0000 2021	The crowd size at the inauguration, which became one of the first controversies of the Trump presidency, will not b… https://t.co/9HfS8Zn8Bd	70	570	0	
1351930063835582464	Wed Jan 20 16:30:19 +0000 2021	On today's episode of The Daily: We asked supporters of President-elect Joe Biden how they felt — excited, nervous,… https://t.co/iqtQDkYszx	59	540	0	
1351926595318140928	Wed Jan 20 16:16:32 +0000 2021	Watch live with our reporters as Kamala Harris is sworn in as the nation’s first female vice president.… https://t.co/YJi4SioYag	105	919	0	
1351926225174986752	Wed Jan 20 16:15:04 +0000 2021	The basics of the inauguration are simple: The new president takes a 35-word oath on a date prescribed by the Const… https://t.co/bietXEt9M5	58	246	0	
1351924987658182659	Wed Jan 20 16:10:09 +0000 2021	An American will be deported from Bali for “spreading information that could unsettle the public,” Indonesian immig… https://t.co/mtTgPLSPjZ	50	164	0	
1351924886319620097	Wed Jan 20 16:09:45 +0000 2021	Breaking News: Watch live as Kamala Harris is sworn in as the nation’s first female vice president by Justice Sonia… https://t.co/HwJ9vz8hkE	123	851	0	
1351923393843572737	Wed Jan 20 16:03:49 +0000 2021	RT @PatriciaMazzei: Air Force One has landed https://t.co/NJYnghD8ry	46	0	1	Wed Jan 20 15:55:48 +0000 2021
1351922448070012930	Wed Jan 20 16:00:03 +0000 2021	Unlike every other first lady in American history, Jill Biden has said she will keep her full-time job. “I’m going… https://t.co/IEsww78zcb	1356	8828	0	
1351921204513435651	Wed Jan 20 15:55:07 +0000 2021	A Golden State Warriors jersey with “Madame V.P.” on the back will soon hang in Vice President-elect Kamala Harris’… https://t.co/3yiCTSsIzz	49	523	0	
1351921165770645504	Wed Jan 20 15:54:58 +0000 2021	RT @VVFriedman: Using image to underscore a new dawn: on inauguration day, President-elect Biden in a Ralph Lauren suit; Dr. Jill Biden in…	164	0	1	Wed Jan 20 14:58:29 +0000 2021
1351919055461101570	Wed Jan 20 15:46:34 +0000 2021	Eugene Goodman, a Capitol Police officer who was hailed as a hero for facing down members of the mob that breached… https://t.co/Ju3hXaE2iA	1615	12605	0	
1351917413470793728	Wed Jan 20 15:40:03 +0000 2021	The inauguration ceremony of President-elect Joe Biden features a lineup of celebrities, including Jennifer Lopez,… https://t.co/Twj0fyNack	422	2267	0	
1351916681774432258	Wed Jan 20 15:37:08 +0000 2021	President-elect Joe Biden has arrived at the U.S. Capitol. Follow along live: https://t.co/8bUAvl5ZzN https://t.co/Kh6KLaOdKR	79	867	0	
1351916643555930113	Wed Jan 20 15:36:59 +0000 2021	As Air Force One left the tarmac, Frank Sinatra’s “My Way” — an ode to a life lived according to one’s own code — p… https://t.co/Gatcx73jVY	112	433	0	
1351914836989534211	Wed Jan 20 15:29:49 +0000 2021	President Trump used the final speech of his presidency to repeat many of the same falsehoods and exaggerations he… https://t.co/uSz5H7zpvS	150	602	0	
1351914516976693249	Wed Jan 20 15:28:32 +0000 2021	RT @katieglueck: NEW: Kamala Harris has already been calling senators on Austin nomination, pitching mayors on relief plan... our dive into…	255	0	1	Wed Jan 20 15:19:34 +0000 2021
1351911135419756548	Wed Jan 20 15:15:06 +0000 2021	Here’s a schedule of what to expect on #InaugurationDay.https://t.co/Mn6JX8zrLQ	149	728	0	
1351910930108583936	Wed Jan 20 15:14:17 +0000 2021	RT @mikiebarb: On today’s Daily: on the morning of the inauguration, my colleagues and I spoke with Biden and Harris supporters of all stri…	42	0	1	Wed Jan 20 14:12:45 +0000 2021
1351907652968861697	Wed Jan 20 15:01:16 +0000 2021	“Have a good life,” President Trump said to a small crowd of his supporters at Joint Base Andrews before boarding A… https://t.co/m5P3xgULWW	496	2777	0	
1351907371275214848	Wed Jan 20 15:00:09 +0000 2021	President-elect Joe Biden attended Mass at the Cathedral of St. Matthew the Apostle in downtown Washington ahead of… https://t.co/B77QxBNJ7O	195	1714	0	
1351904854327877637	Wed Jan 20 14:50:09 +0000 2021	Lyndon B. Johnson was the first and only president to take the oath of office on a plane. Jimmy Carter was the firs… https://t.co/6m4usqwwGT	142	648	0	
1351902339985256453	Wed Jan 20 14:40:09 +0000 2021	Like much of the pageantry associated with presidential inaugurations, the presence of a Bible at swearing-in cerem… https://t.co/7CuPajTQxG	125	815	0	
1351899856814669826	Wed Jan 20 14:30:17 +0000 2021	In OpinionMr. Biden and his team kept the gears turning and the machine whirring all the way to the White House.… https://t.co/8gl7Cx8cm9	74	635	0	
1351895783738630144	Wed Jan 20 14:14:06 +0000 2021	Luncheons, parades and galas are usually all part of Inauguration Day festivities. But, as cases of the coronavirus… https://t.co/Ds9iOZhWIZ	61	327	0	
1351892316282368000	Wed Jan 20 14:00:19 +0000 2021	Inauguration Day brings with it an awkward transition when one family moves in to the White House, and another move… https://t.co/LVgSMzATPg	65	430	0	
1351888482076139522	Wed Jan 20 13:45:05 +0000 2021	President-elect Joe Biden will be sworn in as president of the United States today in a scaled-back inauguration ce… https://t.co/hxrg9QVnyf	159	804	0	
1351888019859644418	Wed Jan 20 13:43:15 +0000 2021	Anthony Levandowski, a former engineer at Google convicted of stealing trade secrets related to self-driving car te… https://t.co/TWf91p80ev	63	156	0	
1351886579795709954	Wed Jan 20 13:37:32 +0000 2021	President Trump is speaking after leaving the White House for the final time. Follow along here: https://t.co/XB8c4sTHw5	49	309	0	
1351884737137283074	Wed Jan 20 13:30:12 +0000 2021	After the riot at the Capitol, news organizations have turned to journalists with experience in reporting on confli… https://t.co/CrP0maZuCh	79	406	0	
1351884731718184962	Wed Jan 20 13:30:11 +0000 2021	Join our reporters and follow live updates and analysis on #InaugurationDay https://t.co/4Ei97HHjCn https://t.co/QmZvzWafoq	20	82	0	
1351883213266944001	Wed Jan 20 13:24:09 +0000 2021	Breaking News: Donald Trump has left the White House for the final time as the 45th president. Joe Biden will be sw… https://t.co/5a3VFuv56V	782	4915	0	
1351880674312073217	Wed Jan 20 13:14:04 +0000 2021	Only three American presidents have missed the inauguration of their successor. President Trump will join that list.https://t.co/gotJENpf5x	198	816	0	
1351879918578233344	Wed Jan 20 13:11:03 +0000 2021	President Trump issued a wave of pardons and commutations in the final hours of his term. Some of those given cleme… https://t.co/zklUJjW6Z5	146	452	0	
1351878545002426371	Wed Jan 20 13:05:36 +0000 2021	Join our reporters for live coverage and analysis of Inauguration Day.https://t.co/gqqXtURjfg	146	697	0	
1351877193329213440	Wed Jan 20 13:00:14 +0000 2021	When Joe Biden is sworn in as 46th president of the United States, it will be a moment of political triumph that ha… https://t.co/CY6QwDia9z	185	1208	0	
1351873520557584386	Wed Jan 20 12:45:38 +0000 2021	The 1776 Commission report called for “patriotic education” and claimed Americans were being indoctrinated with a f… https://t.co/tKB0u3dSqi	93	464	0	
1351873384318119938	Wed Jan 20 12:45:06 +0000 2021	Lady Gaga is set to perform the national anthem at President-elect Joe Biden’s swearing-in ceremony. The singer’s t… https://t.co/tMdLugA839	1321	9603	0	
1351872843882131458	Wed Jan 20 12:42:57 +0000 2021	President-elect Joe Biden will cancel President Trump’s 1776 Commission, which released a report on Monday that has… https://t.co/3XHcqQMMVW	1187	7377	0	
1351869619808690177	Wed Jan 20 12:30:08 +0000 2021	Joe Biden will be sworn in as president of the United States today. Here's how to watch the inauguration. https://t.co/vpvF4wdA8L	245	1111	0	
1351867093126443011	Wed Jan 20 12:20:06 +0000 2021	President-elect Joe Biden is expected to sign 17 executive orders, memorandums and proclamations from the Oval Offi… https://t.co/SoaLWgLB8M	390	2401	0	
1351864573062766600	Wed Jan 20 12:10:05 +0000 2021	Vice President-elect Kamala Harris will make history today. https://t.co/rWtSOOZDnJ	754	5249	0	
1351862111006240775	Wed Jan 20 12:00:18 +0000 2021	President-elect Joe Biden will bring with him the largest team ever assembled inside the White House to tackle clim… https://t.co/QOKjlmXkAu	425	3130	0	
1351858297972862977	Wed Jan 20 11:45:09 +0000 2021	On the eve of his inauguration, President-elect Joe Biden led a national mourning for Americans killed by the coron… https://t.co/l8V4LtDFvB	371	2328	0	
1351854093740990464	Wed Jan 20 11:28:26 +0000 2021	President Trump rescinded an executive order he issued in 2017 to bar former White House employees from lobbying th… https://t.co/IvXBryiGk8	343	773	0	
1351850738125836291	Wed Jan 20 11:15:06 +0000 2021	Vice President-elect Kamala Harris and her husband, Doug Emhoff, are set to move into an often overlooked Washingto… https://t.co/T49VI4XPsY	210	1627	0	
1351848209874903044	Wed Jan 20 11:05:04 +0000 2021	RT @MujMash: India is starting to supply its locally manufactured version of the AstraZeneca COVID vaccine to nearby countries — first ship…	47	0	1	Wed Jan 20 10:39:55 +0000 2021
1351846995875528704	Wed Jan 20 11:00:14 +0000 2021	After four years in office, President Trump will leave behind a country that is divided, impassioned, fearful, radi… https://t.co/enE9ooAh9z	333	1870	0	
1351843179407036418	Wed Jan 20 10:45:04 +0000 2021	On the final day of the Trump presidency, Secretary of State Mike Pompeo said that China was carrying out a genocid… https://t.co/GVma46b5Nq	111	294	0	
1351839398317449218	Wed Jan 20 10:30:03 +0000 2021	At 78, President-elect Joe Biden is set to become the oldest person ever sworn in as president. President Trump cur… https://t.co/F92dUfLGtS	198	1056	0	
1351835625994002434	Wed Jan 20 10:15:03 +0000 2021	With just hours left in office, President Trump issued a wave of pardons and commutations. Here are some of the peo… https://t.co/56SCll2w53	139	288	0	
1351830589691867137	Wed Jan 20 09:55:03 +0000 2021	After a Canadian teenager got lost on a snowy mountain in British Columbia, his canny survival instincts kicked in.https://t.co/43G0PNROM3	64	382	0	
1351809223366213632	Wed Jan 20 08:30:08 +0000 2021	Here's a look at some of the highlights worth watching from late-night TV. https://t.co/q6zGxptjo3	63	400	0	
1351794117592887298	Wed Jan 20 07:30:07 +0000 2021	Annabel Yao, the youngest daughter of the founder of Huawei, released a documentary, a magazine cover and a music v… https://t.co/GtszYpgh2z	135	396	0	
1351779024201244673	Wed Jan 20 06:30:08 +0000 2021	California’s terrifying coronavirus surge, which has overwhelmed hospitals and killed thousands, appears to be subs… https://t.co/rOGi9ngpoZ	63	406	0	
1351775242092498944	Wed Jan 20 06:15:07 +0000 2021	Breaking News: With hours left in office, President Trump granted clemency to more allies, including Elliott Broidy… https://t.co/MYAQeBBQdk	151	375	0	
1351772802819399683	Wed Jan 20 06:05:25 +0000 2021	Donald Trump's presidency in six minutes. https://t.co/zK4LCBmAgZ https://t.co/xYmLvtHxRv	1918	4798	0	
1351771463582420992	Wed Jan 20 06:00:06 +0000 2021	Republicans who voted against certifying the election have a powerful protection against backlash at the ballot box… https://t.co/Q0vL6Hh6jn	121	375	0	
1351767682228563968	Wed Jan 20 05:45:04 +0000 2021	The looming impeachment trial of President Trump in the Senate presents a complication for Democrats hoping for a f… https://t.co/9q5urP26XU	69	420	0	
1351763914690850816	Wed Jan 20 05:30:06 +0000 2021	On the eve of his inauguration, President-elect Joe Biden led a national mourning for the 400,000 Americans who hav… https://t.co/J3fvxsc9Fa	460	3695	0	
1351760134914121728	Wed Jan 20 05:15:05 +0000 2021	A new study suggests widespread screening for one of Covid-19’s trademark signs, the loss of the sense of smell, co… https://t.co/2R3PWLOf77	44	246	0	
1351756369544802306	Wed Jan 20 05:00:07 +0000 2021	The incoming Biden team has been withholding the names of several interim officials to avoid repercussions from dep… https://t.co/h15PtB9Ti2	221	1009	0	
1351754118143090688	Wed Jan 20 04:51:10 +0000 2021	Breaking News: President Trump pardoned Steve Bannon, the former White House chief strategist who was charged with… https://t.co/I5NzBU6Kuk	1489	2483	0	
1351751325189623809	Wed Jan 20 04:40:04 +0000 2021	Three people tied to a right-wing militia were charged with conspiring to commit federal crimes over their involvem… https://t.co/mHPXH2sLjZ	216	816	0	
1351748822221922305	Wed Jan 20 04:30:08 +0000 2021	A new variant of the virus originated in California and accounted for more than half of the samples tested last wee… https://t.co/7jhGMJEf9m	189	447	0	
1351746292477792256	Wed Jan 20 04:20:05 +0000 2021	As President Trump's term comes to an end, here is a look back at the most unforgettable moments from his tumultuou… https://t.co/t6AiImHWWt	140	550	0	
1351743772753846272	Wed Jan 20 04:10:04 +0000 2021	A Wisconsin pharmacist accused of purposefully spoiling doses of Covid-19 vaccines pleaded not guilty on Tuesday to… https://t.co/FtbJ30hdPh	64	206	0	
1351741300266196992	Wed Jan 20 04:00:14 +0000 2021	For many families of the victims of Sriwijaya Air Flight 182, which crashed on Jan. 9, the uncertainty about what h… https://t.co/T24Hnv5sfl	27	160	0	
1351736215108726784	Wed Jan 20 03:40:02 +0000 2021	Three residents of Beverly Hills, California, — one seen wearing a Louis Vuitton sweater during the Capitol riot on… https://t.co/ym3l0FW6sS	232	1210	0	
1351733727475412995	Wed Jan 20 03:30:09 +0000 2021	Baby names derived from optimistic meanings — like “Zora,” “Alma” and “Lucius” — have been trending upward since th… https://t.co/Vz2YVucMeI	44	231	0	
1351731192169705478	Wed Jan 20 03:20:04 +0000 2021	The Nebra sky disk is one of the most unique objects ever dug up from European prehistory. Archaeologists can't sto… https://t.co/iXqZFEjDuI	85	354	0	
1351728684143677440	Wed Jan 20 03:10:06 +0000 2021	Urging unity, President-elect Joe Biden appears wary of prosecuting a former president.But many Democrats want to… https://t.co/ClbB1vmetN	111	797	0	
1351726203007348738	Wed Jan 20 03:00:15 +0000 2021	On his first day in office, President-elect Joe Biden will propose giving millions of undocumented immigrants a cha… https://t.co/XJGHIP7tS0	241	1396	0	
1351721140994138115	Wed Jan 20 02:40:08 +0000 2021	College Board, the organization that produces the SAT, said on Tuesday that it would scrap SAT subject tests and th… https://t.co/aroVFi834y	95	371	0	
1351719871579623425	Wed Jan 20 02:35:05 +0000 2021	RT @smbahr14: I caught up with @euphoriaHBO's @hunters for @nytimesarts about what she watched, listened to and ate during her time in NYC…	18	0	1	Tue Jan 19 21:34:30 +0000 2021
1351718638642991108	Wed Jan 20 02:30:11 +0000 2021	A California man flew from Los Angeles to O’Hare International Airport on October 19 and never left the airport. Af… https://t.co/jypuFMqTWq	137	616	0	
1351716092570464256	Wed Jan 20 02:20:04 +0000 2021	A report by President Trump’s 1776 Commission, advocating “patriotic education,” has no citations, and was written… https://t.co/kt3rVOze7j	179	642	0	
1351713577988714497	Wed Jan 20 02:10:05 +0000 2021	After four weathering years of tumult, what was most memorable at the end was not how different Melania Trump seeme… https://t.co/saN34lPYnD	235	1690	0	
1351711064547876865	Wed Jan 20 02:00:06 +0000 2021	Fox News fired a politics editor who defended the network’s election night projection that Joe Biden won Arizona. T… https://t.co/gwy43vK4mn	219	612	0	
1351708558719643649	Wed Jan 20 01:50:08 +0000 2021	The handoff of power from President Trump to President-elect Joe Biden on Wednesday will involve a grim new piece o… https://t.co/AGJUKxykpV	124	708	0	
1351706018007363585	Wed Jan 20 01:40:02 +0000 2021	An American soldier discussed the 9/11 Memorial as a potential target for terror attacks in the U.S. and shared ins… https://t.co/uoVScD7NOV	180	331	0	
1351703570312257537	Wed Jan 20 01:30:19 +0000 2021	Don Sutton, the Hall of Fame right-handed pitcher, has died. Sutton won 324 games over 23 years for five teams, mos… https://t.co/GKynKPH3Wa	75	309	0	
1351701015201009665	Wed Jan 20 01:20:10 +0000 2021	Doug Mills, a New York Times photographer in the Washington bureau, reflects on four years of documenting the Trump… https://t.co/cjDBoO1LBw	287	1170	0	
1351698477995220998	Wed Jan 20 01:10:05 +0000 2021	The pandemic has damaged the economy and cost millions of people their livelihoods. These are some of the areas tha… https://t.co/eOZIItUnsm	110	573	0	
1351695994388406275	Wed Jan 20 01:00:13 +0000 2021	In OpinionMake America Great Again is a politics of grievance complete with its own myths and symbols, writes B… https://t.co/2PrW4lpZx6	72	318	0	
1351692209322680322	Wed Jan 20 00:45:10 +0000 2021	The Justice Department will not pursue insider trading charges against Senator Richard Burr, who dumped hundreds of… https://t.co/eFmmHkl2cQ	157	321	0	
1351690918731128833	Wed Jan 20 00:40:02 +0000 2021	Twelve National Guard members have been removed from inauguration duties, Defense Department officials said on Tues… https://t.co/bJz2tul4Nm	250	844	0	
1351688433186590722	Wed Jan 20 00:30:10 +0000 2021	How do you avoid the more-contagious version of the coronavirus? We spoke with some of the leading virus and infect… https://t.co/azt7gMo0Gi	117	267	0	
1351685903236919307	Wed Jan 20 00:20:07 +0000 2021	Two members of a “straight pride” group were arrested on Tuesday for their alleged involvement in the Capitol rampa… https://t.co/f6mPq0iAXJ	187	687	0	
1351684638079668227	Wed Jan 20 00:15:05 +0000 2021	RT @JesseKGreen: Is Donald Trump more of a Macbeth or a King Lear? If the latter, is Mike Pence more of a Regan or a Cordelia? These and ot…	31	0	1	Tue Jan 19 21:52:59 +0000 2021
1351683389036879874	Wed Jan 20 00:10:07 +0000 2021	Here's a complete list of Trump's Twitter insults, from when he declared his candidacy for president in June 2015 t… https://t.co/WlYAE52JVF	725	1618	0	
1351680869065510914	Wed Jan 20 00:00:06 +0000 2021	“To heal, we must remember,” President-elect Joe Biden said on Tuesday at a ceremony to honor the more than 400,000… https://t.co/VjFHJ767Zt	541	3304	0	
1351678337261985795	Tue Jan 19 23:50:03 +0000 2021	RT @tripgabriel: Arturo Sutter, a Biden voter in Miami, said that if the actions of Trump and his family were not investigated and punished…	174	0	1	Tue Jan 19 22:49:07 +0000 2021
1351675829181407233	Tue Jan 19 23:40:05 +0000 2021	Russia is considering issuing a Covid passport that could ease travel and commerce for people who have been vacci… https://t.co/Q7XCivefv0	64	219	0	
1351673334614863874	Tue Jan 19 23:30:10 +0000 2021	“More must be done” in providing economic aid to American families during the pandemic, Janet Yellen said at her co… https://t.co/OCdoraEWnw	119	556	0	
1351672046934253577	Tue Jan 19 23:25:03 +0000 2021	RT @maggieNYT: .@katierogers and me on the outgoing first lady, who was often left reacting to spectacles her husband created, but also is…	471	0	1	Tue Jan 19 22:36:03 +0000 2021
1351670801066549250	Tue Jan 19 23:20:06 +0000 2021	U.S. airfares fell to their lowest level in at least two decades last summer, with the average price for a one-way… https://t.co/7ob8TZzotx	46	215	0	
1351669885831700483	Tue Jan 19 23:16:28 +0000 2021	RT @EricSchmittNYT: 12 National Guard members removed from Inauguration duties, two for making menacing anti-government comments amid right…	75	0	1	Tue Jan 19 22:52:03 +0000 2021
1351669528493780993	Tue Jan 19 23:15:03 +0000 2021	President Trump was warned by the White House counsel against pardoning GOP lawmakers who might be connected to the… https://t.co/D1qpc5x4XY	470	1685	0	
1351668281002905607	Tue Jan 19 23:10:05 +0000 2021	News Analysis: President Trump’s imprint on the world will linger. His “America First” policies galvanized other na… https://t.co/3hczHxyDAd	98	430	0	
1351665788428709888	Tue Jan 19 23:00:11 +0000 2021	Inauguration Day brings with it an awkward transition when one family moves in to the White House, and another move… https://t.co/30WzZHkG4r	76	404	0	
1351664773725900811	Tue Jan 19 22:56:09 +0000 2021	At least 19 Capitol Police officers are said to have either tested positive for the coronavirus or were found throu… https://t.co/7TUYBF4qiy	1064	1974	0	
1351662868480057346	Tue Jan 19 22:48:35 +0000 2021	RT @carlzimmer: While we were worried about B.1.1.7 showing up in the US, another coronavirus variant had already emerged and exploded in C…	227	0	1	Tue Jan 19 22:27:54 +0000 2021
1351660726675513349	Tue Jan 19 22:40:04 +0000 2021	Merchandise with phrases like Battle for Capitol Hill Veteran and MAGA Civil War has continued to proliferate o… https://t.co/mpT98q54tV	82	222	0	
1351658219974905865	Tue Jan 19 22:30:06 +0000 2021	RT @antontroian: An aqua disco and a windowless hookah lounge with a pole-dancing stage: Navalny releases a report on Putin's palace, f…	47	0	1	Tue Jan 19 21:43:21 +0000 2021
1351655691262570498	Tue Jan 19 22:20:04 +0000 2021	“It’s my way of acknowledging the momentous occasion that is coming.” Women across the U.S. have pledged to wear pe… https://t.co/b3z7mzMbkN	452	3403	0	
1351654628719517698	Tue Jan 19 22:15:50 +0000 2021	We tracked all of the verbal attacks Donald Trump posted on Twitter, from when he declared his candidacy for presid… https://t.co/bxCyjoxHgy	2330	4628	0	
1351653170079019016	Tue Jan 19 22:10:02 +0000 2021	Avril Haines, President-elect Joe Biden’s nominee to be the next director of national intelligence, told senators o… https://t.co/82nNLZvXtG	315	1388	0	
1351652172824510467	Tue Jan 19 22:06:05 +0000 2021	Canada will not receive any vaccine shipments from Pfizer next week, but that should not affect the government’s pl… https://t.co/czhGopqWya	70	218	0	
1351650716495065089	Tue Jan 19 22:00:17 +0000 2021	At 78, President-elect Joe Biden is set to become the oldest person ever sworn in as president. President Trump cur… https://t.co/TGEokLghIt	108	697	0	
1351648904014671881	Tue Jan 19 21:53:05 +0000 2021	President Trump released a 20-minute farewell video on Tuesday. As I prepare to hand power over to a new administr… https://t.co/94WhEloraj	272	1155	0	
1351647542421946368	Tue Jan 19 21:47:41 +0000 2021	Conor McGregor, the UFC star, has been sued in Ireland by a woman who accused him of raping her at a hotel in 2018.… https://t.co/bvvF4xA7US	57	270	0	
