status_id	created_at	text	retweet_count	favorite_count	is_retweet	retweet_created_at
1346574728216141826	Tue Jan 05 21:50:08 +0000 2021	The effort to vaccinate millions of New Yorkers has been off to a sluggish start, alarming city and health official… https://t.co/EfJTlAKdBc	49	157	0	
1346573754705596416	Tue Jan 05 21:46:15 +0000 2021	RT @ByMikeBaker: Proud Boys leader Enrique Tarrio has been released from custody, but a judge ordered him to stay out of D.C.Officials ar…	49	0	1	Tue Jan 05 21:43:52 +0000 2021
1346572202011983877	Tue Jan 05 21:40:05 +0000 2021	Georgia Secretary of State Brad Raffensperger shot down President Trump’s suggestion Tuesday that Dominion voting m… https://t.co/SZWcdHD7Uh	147	551	0	
1346571695386202117	Tue Jan 05 21:38:04 +0000 2021	A prosecutor has declined to bring charges against the police officer who shot Jacob Blake outside an apartment bui… https://t.co/2va1x520I2	261	530	0	
1346569697093955586	Tue Jan 05 21:30:08 +0000 2021	Three of the four Senate candidates in Georgia — Jon Ossoff, Sen. Kelly Loeffler and the Rev. Raphael Warnock — pro… https://t.co/FzUyVGim6F	55	283	0	
1346568808249622528	Tue Jan 05 21:26:36 +0000 2021	RT @jeligon: The police officer who shot Jacob Blake in Kenosha last summer will not be charged with any crimes, the local prosecutor said.…	142	0	1	Tue Jan 05 21:22:51 +0000 2021
1346567416726302722	Tue Jan 05 21:21:04 +0000 2021	In a chaotic session, Republicans in the Pennsylvania Legislature voted not to seat a Democratic lawmaker who was e… https://t.co/D2Raz7T1Br	483	822	0	
1346567176690544651	Tue Jan 05 21:20:07 +0000 2021	When Tyler Perry's absentee ballot didn't arrive in time, he hopped on a flight from Wyoming to Georgia to vote in… https://t.co/sloKmHhvMV	906	9937	0	
1346564697038979076	Tue Jan 05 21:10:16 +0000 2021	Just over half of the teachers who were expected to report to Chicago school buildings on Monday, as the first step… https://t.co/3fayi4JXuq	80	360	0	
1346563541168508928	Tue Jan 05 21:05:40 +0000 2021	Breaking News: American intelligence agencies formally said Russia was “likely” behind a major hack of the U.S. gov… https://t.co/419aqWAL1Q	294	680	0	
1346562148676358146	Tue Jan 05 21:00:08 +0000 2021	Voters lined up to cast their ballots in Marietta, Georgia, on Tuesday in the state's Senate runoffs. Officials sai… https://t.co/CYQtUgYd9Y	44	286	0	
1346559617439039496	Tue Jan 05 20:50:05 +0000 2021	RT @nytgraphics: About 4.8 million people in the U.S. have received a dose of a Covid-19 vaccine, far short of the goal federal officials s…	53	0	1	Tue Jan 05 20:31:12 +0000 2021
1346558358288027648	Tue Jan 05 20:45:05 +0000 2021	It’s possible — but certainly not guaranteed — that we’ll know who won Georgia's Senate runoff elections on Tuesday… https://t.co/BfKi8JvCEL	52	264	0	
1346554591287136258	Tue Jan 05 20:30:06 +0000 2021	A longtime conservative lawyer named Cleta Mitchell, who was on the call in which President Trump threatened Georgi… https://t.co/qkOkB1XJB0	423	985	0	
1346552819785097219	Tue Jan 05 20:23:04 +0000 2021	RT @MarkLandler: Scotland’s leader, Nicola Sturgeon, tells Trump to forget an Inauguration Day escape to his Turnberry golf resort. Playing…	516	0	1	Tue Jan 05 19:26:48 +0000 2021
1346550805588025346	Tue Jan 05 20:15:04 +0000 2021	Here are explanations about how eight of the leading coronavirus vaccines work. https://t.co/vQhPciRomM	176	449	0	
1346549958699315201	Tue Jan 05 20:11:42 +0000 2021	The Grammy Awards, set for Jan. 31, have been delayed over concerns about Covid-19, which has been spreading rapidl… https://t.co/yGP3JCqew3	101	392	0	
1346548296807018496	Tue Jan 05 20:05:06 +0000 2021	Saudi Arabia and other oil producers reached a deal to reduce overall oil output in February and March, leading to… https://t.co/sWwmLOJBPH	59	144	0	
1346546854419456001	Tue Jan 05 19:59:22 +0000 2021	Read more on how New York’s largest health system has sued 2,500 patients over medical debt during the pandemic. https://t.co/qzJg0FqYWQ	22	54	0	
1346546852875956229	Tue Jan 05 19:59:22 +0000 2021	One of Northwell’s executives defended the lawsuits, saying the system had the right to collect what it was owed. H… https://t.co/R1j8nzphKz	9	49	0	
1346546849012985857	Tue Jan 05 19:59:21 +0000 2021	Many patients are worried Northwell Health would seize their paychecks and leave them unable to pay rent.… https://t.co/orsQj1gfFw	15	41	0	
1346546845829517313	Tue Jan 05 19:59:20 +0000 2021	Northwell Health, which is run by one of Cuomo’s closest allies, has sued 2,500 patients over medical debt during t… https://t.co/qam09d8LYv	24	49	0	
1346546844617367552	Tue Jan 05 19:59:20 +0000 2021	Gov. Andrew Cuomo ordered New York's state-run hospitals to stop suing patients over unpaid medical bills when the… https://t.co/R3SgAT5K9Z	191	502	0	
1346545026453676033	Tue Jan 05 19:52:06 +0000 2021	Today's Great Read: Imagery from Cold War-era Corona satellites is helping scientists fill in how we have changed o… https://t.co/4C3sJEyB6G	33	160	0	
1346543262975332352	Tue Jan 05 19:45:06 +0000 2021	President Trump urged his supporters to vote in the Georgia runoffs — after Senator Kelly Loeffler, a Republican ca… https://t.co/p1B5UphKD6	34	154	0	
1346541269032591366	Tue Jan 05 19:37:10 +0000 2021	Breaking News: Scientists are studying vaccine data to see if the Moderna supply can be doubled by cutting doses in… https://t.co/w0ZY69gm8t	125	434	0	
1346540751996510209	Tue Jan 05 19:35:07 +0000 2021	Scotland won’t welcome President Trump under new virus restrictions, the country's first minister Nicola Sturgeon s… https://t.co/Uk0pXJOTlC	380	2696	0	
1346539518082605058	Tue Jan 05 19:30:13 +0000 2021	This is a story full of malice and exorbitant legal fees: The ex-wife of a Russian oligarch is suing her son for ne… https://t.co/1y2fVOOGCs	45	198	0	
1346538215952547840	Tue Jan 05 19:25:02 +0000 2021	Advisers to the WHO have recommended that countries stick with Pfizer’s Covid-19 vaccination timetable of two doses… https://t.co/apzBhqparn	71	217	0	
1346536972442021888	Tue Jan 05 19:20:06 +0000 2021	We talked to voters in one of the largest and most diverse counties in Georgia about how they feel casting ballots… https://t.co/y06NiGII0L	31	198	0	
1346535713840488449	Tue Jan 05 19:15:06 +0000 2021	The New York Post announced a new top editor: Keith Poole, the deputy editor in chief of The Sun, the British tablo… https://t.co/eg1hMeg1X2	28	135	0	
1346531983422332933	Tue Jan 05 19:00:16 +0000 2021	Vice President Mike Pence will play a crucial but largely ceremonial role in certifying the election results in Con… https://t.co/8LRM6rp3f6	657	2205	0	
1346530728251707394	Tue Jan 05 18:55:17 +0000 2021	Senators Ted Cruz of Texas and Kelly Loeffler of Georgia are said to be planning to object to electoral votes won b… https://t.co/kW0mQglYxH	51	252	0	
1346529414931165184	Tue Jan 05 18:50:04 +0000 2021	Germany has extended its nationwide lockdown by three weeks. Under the new restrictions, members of a household can… https://t.co/Wk1m2ZGoDJ	340	836	0	
1346526896247468042	Tue Jan 05 18:40:03 +0000 2021	A U.S. judge in Atlanta denied a last-minute effort by President Trump to decertify Georgia’s presidential election… https://t.co/KSQ07IVXHT	3348	11088	0	
1346524425345245185	Tue Jan 05 18:30:14 +0000 2021	Vice President Mike Pence will play a delicate role on Wednesday when Congress convenes to ratify President-elect J… https://t.co/TuOv7z5VQL	114	616	0	
1346520635254693890	Tue Jan 05 18:15:11 +0000 2021	“It’s like the Hunger Games for parking. It’s not harder now — it’s relentless.” Since the pandemic hit, car owne… https://t.co/Pnl9pNDuMG	47	266	0	
1346517279014608896	Tue Jan 05 18:01:51 +0000 2021	RT @nytopinion: Join editorial board member @mcottle to discuss the best, worst and weirdest political players and Georgia’s Senate runoff…	25	0	1	Tue Jan 05 18:00:05 +0000 2021
1346516848809013249	Tue Jan 05 18:00:08 +0000 2021	Several Gulf states agreed to ease Qatar’s isolation from its Arab neighbors, which have blockaded the country sinc… https://t.co/5R7ODlYO0f	51	162	0	
1346514327289921537	Tue Jan 05 17:50:07 +0000 2021	“You always hear every election cycle that this vote matters more than anything — but that feels true this time,” s… https://t.co/dGncElD12T	67	449	0	
1346513052666097669	Tue Jan 05 17:45:03 +0000 2021	California has an oxygen shortage for patients as it sees a surge in Covid cases. LA County’s EMS agency issued gui… https://t.co/1jvOG7ubso	151	278	0	
1346511818781552645	Tue Jan 05 17:40:09 +0000 2021	Cleveland Browns head coach Kevin Stefanski, two other coaches and two players tested positive for Covid-19, the te… https://t.co/PM0FgfCifW	43	171	0	
1346509785160699904	Tue Jan 05 17:32:04 +0000 2021	The Trump administration gutted protections for migratory birds on Tuesday, delivering a parting gift to the oil an… https://t.co/MLnAP6I2IN	329	442	0	
1346509098133708800	Tue Jan 05 17:29:20 +0000 2021	Tanya Roberts's death was confirmed on Tuesday by her companion. Her publicist, who was given erroneous information… https://t.co/tZU85CdIFJ	48	200	0	
1346506772497002497	Tue Jan 05 17:20:06 +0000 2021	Tanya Roberts was an actress who found fame in the 1980s as a Charlie’s Angel and a Bond Girl, and later returned t… https://t.co/oN6qiSmdHo	226	1074	0	
1346503544510283788	Tue Jan 05 17:07:16 +0000 2021	Breaking News: President Trump escalated his efforts to pressure Vice President Mike Pence to overturn President-el… https://t.co/C8LmO4riIb	664	1854	0	
1346501785704402944	Tue Jan 05 17:00:17 +0000 2021	More than 40 people have tested positive for the coronavirus in cases that are believed to be connected to Christma… https://t.co/SMuPgg3KJv	87	274	0	
1346497958792073218	Tue Jan 05 16:45:04 +0000 2021	In Bridgerton, her first series for Netflix, Shonda Rhimes proves that people of color do not have to be erased… https://t.co/4r2rx16gLx	177	1765	0	
1346494182798602241	Tue Jan 05 16:30:04 +0000 2021	Some Georgia voters who cast ballots for President-elect Joe Biden in November are opting for the Republicans in th… https://t.co/YA5pYV9DVN	126	526	0	
1346490419392237570	Tue Jan 05 16:15:07 +0000 2021	RT @nytgraphics: We continue to monitor updates to virus restrictions in all 50 states.In Colorado, indoor dining is now allowed statewide…	36	0	1	Tue Jan 05 15:30:28 +0000 2021
1346486668786683904	Tue Jan 05 16:00:13 +0000 2021	Georgia voters will decide two runoffs today that will determine control of the Senate.— Sen. David Perdue faces D… https://t.co/oYDb0BnHHj	301	835	0	
1346482852578299905	Tue Jan 05 15:45:03 +0000 2021	China now resembles what “normal” was like in the pre-pandemic world. The country reported fewer than 100,000 coron… https://t.co/yXDDvhdCN2	129	560	0	
1346480353561571328	Tue Jan 05 15:35:07 +0000 2021	Not a single major telephone pollster conducted a survey in Georgia ahead of the election on Tuesday — partly out o… https://t.co/cYLc64bciz	33	189	0	
1346479871506018304	Tue Jan 05 15:33:12 +0000 2021	RT @brianmrosenthal: NEW: In the pandemic, almost all major NY hospitals stopped suing patients over unpaid medical bills. But the state’s…	317	0	1	Tue Jan 05 15:30:48 +0000 2021
1346479132490805253	Tue Jan 05 15:30:16 +0000 2021	A former Momofuku employee’s essay raises questions about how we treat restaurant workers, who have often labored i… https://t.co/lXqPUmiRHC	85	458	0	
1346471563860668417	Tue Jan 05 15:00:11 +0000 2021	Prince’s estate is worth $163.2 million — about double what its administrators claimed — according to the IRS. Now… https://t.co/pvV93hk9xn	199	772	0	
1346469002613121029	Tue Jan 05 14:50:01 +0000 2021	RT @cegoldbaum: Gentleman's agreements were nullified. Zipcar users &amp; private car owners drew battle lines. A brawl broke out. With car s…	40	0	1	Tue Jan 05 12:53:58 +0000 2021
1346466522273697793	Tue Jan 05 14:40:09 +0000 2021	Hours after announcing the death of Tanya Roberts, the actress known for starring opposite Roger Moore in his final… https://t.co/pgBg6yTart	127	764	0	
1346465285440757761	Tue Jan 05 14:35:14 +0000 2021	Nearly 40% of all registered voters in Georgia have cast their ballots in the state’s runoff elections on Tuesday.… https://t.co/HMhDgQjBRn	61	347	0	
1346460195241791488	Tue Jan 05 14:15:01 +0000 2021	Vietnam sentenced three journalists to prison on Tuesday as part of a broader attack on speech. The latest crackdow… https://t.co/ElKf8c2YF9	101	224	0	
1346456508515676161	Tue Jan 05 14:00:22 +0000 2021	Here’s a quick look at the lives and careers of the four candidates in Georgia’s runoff elections on Tuesday. Their… https://t.co/kpsWCoKtgj	37	127	0	
1346451387471818752	Tue Jan 05 13:40:01 +0000 2021	The suspect in a Queens bomb hoax, a 22-year-old man with extremist right-wing views, turned himself in to the poli… https://t.co/j4LUv4RZVe	115	395	0	
1346448895409332227	Tue Jan 05 13:30:07 +0000 2021	Indonesia, which has the most coronavirus infections in Southeast Asia, is eager to build support for its vaccine p… https://t.co/kBw9e5Ev65	91	256	0	
1346446387639185409	Tue Jan 05 13:20:09 +0000 2021	RT @cliffordlevy: NEW: Louis Shenker, who has expressed right-wing extremist views, turned himself in to the NYC police overnight.He was s…	33	0	1	Tue Jan 05 13:14:54 +0000 2021
1346441382307770368	Tue Jan 05 13:00:15 +0000 2021	Control of the Senate is at stake. The candidates have shattered spending records. President Trump hovers over the… https://t.co/DcZuvTLlmy	46	196	0	
1346437572612993028	Tue Jan 05 12:45:07 +0000 2021	RT @andrewrsorkin: Just out. My column: Here's a novel idea to keep lawmakers from trading stocks without needing a sentence of new legisla…	387	0	1	Tue Jan 05 12:20:08 +0000 2021
1346433783470448646	Tue Jan 05 12:30:04 +0000 2021	Republicans have often done well in runoff elections in Georgia. Could President Trump’s attacks on the state’s ele… https://t.co/pdisQ351kq	30	149	0	
1346426245333065731	Tue Jan 05 12:00:06 +0000 2021	Gabriel Sterling, a top election official in Georgia, systematically debunked President Trump’s false claims of vot… https://t.co/pCG3LLJJnk	678	3623	0	
1346418179367727106	Tue Jan 05 11:28:03 +0000 2021	Georgia polls open at 7 a.m. on Tuesday in the all-important Senate runoff elections, but we won’t start getting re… https://t.co/WSmWoGRZou	117	449	0	
1346409622383505408	Tue Jan 05 10:54:03 +0000 2021	China now resembles what “normal” was like in the pre-pandemic world. The country reported fewer than 100,000 coron… https://t.co/vgeKvHDUYO	241	1138	0	
1346402327662616576	Tue Jan 05 10:25:04 +0000 2021	RT @npfandos: Meet the Teddy Roosevelt-admiring populist with Ivy League credentials and lofty ambition who will object to certifying Joe B…	46	0	1	Tue Jan 05 03:30:24 +0000 2021
1346380948288516096	Tue Jan 05 09:00:07 +0000 2021	Imagery from the Cold War’s Corona satellites is helping scientists fill in how we have changed our planet in the p… https://t.co/2ZpGJorAI5	52	213	0	
1346365867538460672	Tue Jan 05 08:00:11 +0000 2021	Here's a look at some of the highlights worth watching from late-night TV. https://t.co/gttl6DCwBW	34	258	0	
1346365860320079873	Tue Jan 05 08:00:10 +0000 2021	Citizens of China don’t have freedom of speech, freedom of worship or freedom from fear, writes @LiYuan6. But th… https://t.co/00qMix3TRm	94	378	0	
1346340660568317952	Tue Jan 05 06:20:01 +0000 2021	Here are some of the technology-related developments our journalists think will be big in 2021. https://t.co/KGTeBbaPdV	59	186	0	
1346330600496652288	Tue Jan 05 05:40:03 +0000 2021	The biggest companies that install and finance home solar systems are reporting hundreds of millions of dollars in… https://t.co/fPaifzcoyL	54	202	0	
1346325584360710144	Tue Jan 05 05:20:07 +0000 2021	The billionaire financier Carl Icahn is selling $600 million of the investment in Herbalife that he made as it was… https://t.co/b1ioL9L5wX	132	415	0	
1346320568962920450	Tue Jan 05 05:00:11 +0000 2021	The pandemic has made the office more of a consumer product. And just like every consumer product, the office will… https://t.co/UEgbXFYbPO	81	370	0	
1346318027978121217	Tue Jan 05 04:50:05 +0000 2021	RT @dickstevenson: On Monday night Mr. Trump openly pressured the vice president, saying, “I hope Mike Pence comes through for us, I have t…	263	0	1	Tue Jan 05 02:41:55 +0000 2021
1346315500696064000	Tue Jan 05 04:40:03 +0000 2021	“My New Year’s kitchen resolution is to follow recipes exactly as written, to get to know their creators without al… https://t.co/Z9YrV22f62	26	209	0	
1346310483826061312	Tue Jan 05 04:20:07 +0000 2021	RT @nytpolitics: Here’s what we know about Georgia's two Senate runoff races ahead of election day  https://t.co/U9Qo0qaOQT	30	0	1	Mon Jan 04 22:11:57 +0000 2021
1346307947756986369	Tue Jan 05 04:10:02 +0000 2021	With the coronavirus surging and overwhelming hospitals, unions and industry groups in Hollywood are calling for in… https://t.co/FMqobUR9fl	99	397	0	
1346305492168142849	Tue Jan 05 04:00:17 +0000 2021	Hours after announcing the death of Tanya Roberts, the actress known for starring opposite Roger Moore in his final… https://t.co/QnTGqttAlQ	228	897	0	
1346301690451030016	Tue Jan 05 03:45:10 +0000 2021	RT @cliffordlevy: BREAKING: A man with extremist right-wing views is being sought in a big bomb scare at a Queens mall. A Tesla was loaded…	512	0	1	Tue Jan 05 03:28:52 +0000 2021
1346300418666745861	Tue Jan 05 03:40:07 +0000 2021	Sync your calendar with our interactive and never miss an eclipse, a meteor shower, a rocket launch or any other ev… https://t.co/Kbn23FewMe	114	515	0	
1346295373091000321	Tue Jan 05 03:20:04 +0000 2021	RT @AsteadWesley: Tim Gilley said he did not expect Perdue or Loeffler to win“Not without President Trump on the ballot.At the same ti…	31	0	1	Tue Jan 05 03:06:53 +0000 2021
1346290352853049344	Tue Jan 05 03:00:07 +0000 2021	A man driving a van fatally struck a 4-year-old boy and critically injured a 6-year-old boy moments after he had dr… https://t.co/mYUN61Ubio	21	116	0	
1346287815215214594	Tue Jan 05 02:50:02 +0000 2021	RT @MaggieAstor: Gabriel Sterling, a Republican election official in Georgia, debunked Trump's already-debunked voter fraud claims and begg…	43	0	1	Tue Jan 05 01:45:00 +0000 2021
1346285311115071488	Tue Jan 05 02:40:05 +0000 2021	Mass vaccination would be a challenge under any circumstances. But the coronavirus vaccine's slow rollout during an… https://t.co/iIfoHBv4Vb	86	323	0	
1346280270341828608	Tue Jan 05 02:20:03 +0000 2021	RT @EricSchmittNYT: White supremacists descend on D.C. to support Trump as city braces for protests and mayor request National Guard help w…	59	0	1	Tue Jan 05 01:21:38 +0000 2021
1346275285583491074	Tue Jan 05 02:00:15 +0000 2021	About a fifth of U.S. hospitals with intensive care units (638 hospitals) reported that at least 95% of their ICU b… https://t.co/h1K5KRHkdD	281	457	0	
1346270215533957120	Tue Jan 05 01:40:06 +0000 2021	President Trump’s campaign settled a lawsuit filed by a Boston artist and documentary filmmaker who said he was ass… https://t.co/QcgYtPUbhm	93	453	0	
1346265181333151745	Tue Jan 05 01:20:06 +0000 2021	RT @anniekarni: Pence’s choice: the Constitution or his boss.A hard needle to thread even for the practiced Mr. Pence. W/⁦@maggieNYT⁩…	594	0	1	Tue Jan 05 00:48:42 +0000 2021
1346260194989371392	Tue Jan 05 01:00:17 +0000 2021	Here’s a preview of what to expect in space and astronomy in the year to come. https://t.co/BFXhP6DQ8h	98	416	0	
1346255104794619906	Tue Jan 05 00:40:03 +0000 2021	“SpongeBob SquarePants” is moving from a pineapple under the sea to Hulu Live in a new deal with ViacomCBS to add 1… https://t.co/O7YcfdpQc9	53	353	0	
1346250078047109125	Tue Jan 05 00:20:05 +0000 2021	RT @nytgraphics: Pennsylvania has mostly reopened, with indoor dining, gyms and entertainment venues open at reduced capacities.In neighbo…	37	0	1	Mon Jan 04 22:33:34 +0000 2021
1346245100733665282	Tue Jan 05 00:00:18 +0000 2021	President-elect Joe Biden confronts an economic crisis unlike any since he last entered office in 2009. The $900 bi… https://t.co/7xREIz0nMi	86	441	0	
1346239996613816321	Mon Jan 04 23:40:01 +0000 2021	RT @LFFriedman: SCOOP: EPA is expected tomorrow to unveil the final version of one of its most controversial regs, a rule that will restric…	105	0	1	Mon Jan 04 23:25:49 +0000 2021
1346238758258171905	Mon Jan 04 23:35:06 +0000 2021	The sprawling efforts to register more voters across Georgia have relied on TikTok, Tinder and text messages to rea… https://t.co/NnFZ4lRuQc	59	472	0	
1346236247489073155	Mon Jan 04 23:25:07 +0000 2021	The leader of the far-right group  Proud Boys was arrested in Washington on Monday, on suspicion of burning a Black… https://t.co/AcSSi41Q1u	813	4339	0	
1346230417851101184	Mon Jan 04 23:01:58 +0000 2021	The Wisconsin pharmacist accused of sabotaging over 500 doses of the Covid-19 vaccine was “an admitted conspiracy t… https://t.co/X68GaAMJID	595	1472	0	
1346230011217522688	Mon Jan 04 23:00:21 +0000 2021	The pandemic has brought tourism to a halt in the Tuscan village of Castellina in Chianti. Without visitors, who wo… https://t.co/YN5EMozUyE	51	244	0	
1346227436841824261	Mon Jan 04 22:50:07 +0000 2021	Students and recent graduates are struggling to get hired as the oil industry cuts tens of thousands of jobs, and s… https://t.co/c6GQ2fVSb4	130	561	0	
1346224924260773888	Mon Jan 04 22:40:08 +0000 2021	A car left in the parking garage at a mall in Queens contained what looked like a makeshift bomb, the police said.… https://t.co/Y5ogb0dHEp	51	148	0	
1346222437332086784	Mon Jan 04 22:30:15 +0000 2021	The Cut named Lindsay Peoples Wagner as its new editor in chief on Monday. Peoples Wagner, 30, will rejoin New York… https://t.co/rZXTn323zj	96	653	0	
1346221737994842113	Mon Jan 04 22:27:28 +0000 2021	Medical experts said Boris Johnson had little choice but to impose further measures, given the rapid spread of the… https://t.co/ldI0DFjowb	134	526	0	
1346219875619008514	Mon Jan 04 22:20:04 +0000 2021	Foreign leaders now take President Trump’s disregard for democratic and ethical norms for granted. But many of them… https://t.co/dVGdOmA0eo	219	971	0	
1346217365244153856	Mon Jan 04 22:10:06 +0000 2021	Chief executives and other leaders from many of America’s largest businesses urged Congress to certify the electora… https://t.co/KkE2oiQ8tP	202	997	0	
1346214871013191682	Mon Jan 04 22:00:11 +0000 2021	About 4.6 million people in the U.S. have received a dose of a Covid-19 vaccine, according to the CDC — far short o… https://t.co/gOcS47THPB	130	392	0	
1346212329915101186	Mon Jan 04 21:50:05 +0000 2021	Weeks before Christmas, a Swedish official sent a text to all Swedes advising them to follow recommendations and st… https://t.co/xJ7Ed3NVzm	1251	3759	0	
1346207342019432453	Mon Jan 04 21:30:16 +0000 2021	RT @nytgraphics: About a fifth of U.S. hospitals with intensive care units (638 hospitals) reported that at least 95% of their ICU beds wer…	72	0	1	Mon Jan 04 18:49:37 +0000 2021
1346206909108539392	Mon Jan 04 21:28:33 +0000 2021	The latest complication for New York health officials: The first case of a more contagious variant of the virus has… https://t.co/zksKR3Q2Un	35	96	0	
1346205528494628865	Mon Jan 04 21:23:03 +0000 2021	de Blasio and Cuomo have long had a difficult relationship. “Threatening to revoke the privilege of vaccination fro… https://t.co/9zKiKZov7B	18	103	0	
1346205526003224576	Mon Jan 04 21:23:03 +0000 2021	Shortly after de Blasio spoke, Cuomo rejected any notion that his administration was at fault and threatened to fin… https://t.co/K6SkdHydp9	27	83	0	
1346205458080690176	Mon Jan 04 21:22:47 +0000 2021	Mayor Bill de Blasio called on Gov. Andrew Cuomo’s administration to allow New York City to vaccinate a broader arr… https://t.co/vlg8sCrKlt	19	74	0	
1346203913364664320	Mon Jan 04 21:16:38 +0000 2021	New York is facing a growing crisis over the lagging pace of coronavirus vaccinations. The number of people who die… https://t.co/p6YpW2n6Pw	136	442	0	
1346203640449683458	Mon Jan 04 21:15:33 +0000 2021	Update: Slack restored service after experiencing a major disruption on Monday, which lasted for a few hours as mil… https://t.co/1MGMoIE4ZU	15	93	0	
1346203145215619077	Mon Jan 04 21:13:35 +0000 2021	RT @katie_robertson: NEW: Lindsay Peoples Wagner has been named the new editor in chief of @TheCut. She's leaving Teen Vogue, where she's t…	74	0	1	Mon Jan 04 21:01:20 +0000 2021
1346202790071304192	Mon Jan 04 21:12:11 +0000 2021	“This is all easily, provably false.” A top Georgia election official delivered a scathing refutation of President… https://t.co/PuSEanV7pj	302	1823	0	
1346202270107635712	Mon Jan 04 21:10:07 +0000 2021	Former President Barack Obama suggested that President Trump was threatening the fundamental principles of our dem… https://t.co/nV0Cw7KLeO	469	2377	0	
1346199781564174343	Mon Jan 04 21:00:13 +0000 2021	News Analysis: President Trump’s effort to overturn the election he lost has gone beyond mere venting of grievances… https://t.co/RA7wWMdzwc	189	809	0	
1346196218460909569	Mon Jan 04 20:46:04 +0000 2021	RT @Kellen_Browning: Starting 2021 with an uplifting story amid so much bad news. Teachers are partnering with TV stations to broadcast t…	70	0	1	Mon Jan 04 17:55:28 +0000 2021
1346194709488820226	Mon Jan 04 20:40:04 +0000 2021	“People are relapsing left and right.” Just as rates of binge drinking and opioid overdoses are going up, substance… https://t.co/2Hk1Rrxa9q	89	281	0	
