status_id	created_at	text	retweet_count	favorite_count	is_retweet	retweet_created_at
1349256385016582145	Wed Jan 13 07:26:04 +0000 2021	Kim Jong-un, the North Korean leader, said his economic plans had failed at a gathering of his ruling Workers’ Part… https://t.co/dPMAtjdQl0	79	321	0	
1349249233594044417	Wed Jan 13 06:57:39 +0000 2021	Breaking News: The Trump administration executed Lisa Montgomery, the only woman on federal death row and the first… https://t.co/jZOJrvHsqf	1110	2152	0	
1349244813112176642	Wed Jan 13 06:40:05 +0000 2021	As China’s economy has recovered from the coronavirus pandemic, its currency has surged. The renminbi, also known a… https://t.co/O42AYooUa2	82	250	0	
1349234768718798848	Wed Jan 13 06:00:11 +0000 2021	As with other problems during the pandemic, botched technology is often a symptom of misguided policy choices, unde… https://t.co/KRtu2ne6x1	35	151	0	
1349229692872765440	Wed Jan 13 05:40:00 +0000 2021	RT @adamgoldmanNYT: NEW: Pentagon to Arm National Guard Troops Deploying to Capitol for Inauguration w/⁦@helenecooper⁩  https://t.co/A4vaqi…	622	0	1	Wed Jan 13 01:15:25 +0000 2021
1349224665538060288	Wed Jan 13 05:20:02 +0000 2021	Chris Rock is back with an extended cut of his 2018 special, “Tamborine.” It has “more jokes, longer setups and mor… https://t.co/R5erbbPbFK	38	374	0	
1349219148098895872	Wed Jan 13 04:58:06 +0000 2021	Breaking News: YouTube suspended President Trump’s channel from uploading new content for at least seven days over… https://t.co/JbIbfZ7LHp	596	3786	0	
1349217124582092802	Wed Jan 13 04:50:04 +0000 2021	Speaker Nancy Pelosi on Tuesday named nine Democrats as managers of the impeachment trial of President Trump on cha… https://t.co/zBchGHyvjg	200	1595	0	
1349217123931992064	Wed Jan 13 04:50:04 +0000 2021	RT @carolrosenberg: Just in: Guantanamo has received its first shipment of #Covid19 vaccines, inoculated the first 100 prison staff members…	57	0	1	Wed Jan 13 03:55:35 +0000 2021
1349214093199204352	Wed Jan 13 04:38:01 +0000 2021	Breaking News: The House formally called on Vice President Mike Pence to strip President Trump’s powers using the 2… https://t.co/f1AZfkPWoj	247	1184	0	
1349212101315874824	Wed Jan 13 04:30:06 +0000 2021	New York City is investigating whether it can cancel its contracts with the Trump Organization after last week’s de… https://t.co/3waIuttn2E	201	1644	0	
1349209575325638658	Wed Jan 13 04:20:04 +0000 2021	RT @jackhealyNYT: So many people I interviewed for this piece described elders as living libraries, walking dictionaries, breathing reposit…	483	0	1	Tue Jan 12 19:01:53 +0000 2021
1349207057329754113	Wed Jan 13 04:10:04 +0000 2021	Once most adults are immune to the coronavirus — after natural infection or vaccination — it will be like the commo… https://t.co/CPDVVSQGF6	238	940	0	
1349204589279649794	Wed Jan 13 04:00:15 +0000 2021	Senator Mitch McConnell has concluded that President Trump committed impeachable offenses and believes that Democra… https://t.co/1Cc0eng4gy	963	5969	0	
1349202036655534082	Wed Jan 13 03:50:07 +0000 2021	Federal law enforcement officials vowed on Tuesday to accelerate a nationwide manhunt for hundreds of people who co… https://t.co/Zc2oLuVUKb	268	1576	0	
1349199521201463297	Wed Jan 13 03:40:07 +0000 2021	William Webster, a lifelong Republican and the only person to lead both the FBI and the CIA, said that he supported… https://t.co/0KeQvZrPCT	1980	10975	0	
1349194470387027973	Wed Jan 13 03:20:03 +0000 2021	RT @nytgraphics: At least 136,000 coronavirus deaths have been reported among residents and employees of nursing homes in the U.S., accordi…	53	0	1	Tue Jan 12 23:31:32 +0000 2021
1349191950054920194	Wed Jan 13 03:10:02 +0000 2021	A 45-year-old man was charged with making veiled threats last month to commit violence against President-elect Joe… https://t.co/1HiLRmzCxu	536	2197	0	
1349189450677563394	Wed Jan 13 03:00:06 +0000 2021	RT @cliffordlevy: NEW: The Vessel, the spiraling staircase at Hudson Yards in  Manhattan, was closed to visitors, a day after a 21-year-old…	112	0	1	Tue Jan 12 22:13:24 +0000 2021
1349186934552354817	Wed Jan 13 02:50:06 +0000 2021	Bill Belichick, the New England Patriots coach who turned down the Presidential Medal of Freedom, is not the first… https://t.co/vShxieQmJI	108	825	0	
1349181922468106241	Wed Jan 13 02:30:11 +0000 2021	The blowup between President Trump and Mike Pence played out in dramatic fashion behind closed doors last Wednesday… https://t.co/kuorXhzunH	312	1372	0	
1349176863462141968	Wed Jan 13 02:10:05 +0000 2021	RT @SherylNYT: UPDATE: @SpeakerPelosi has just appointed @RepRaskin to lead the prosecution of President Trump in a Senate trial. Below,…	311	0	1	Wed Jan 13 02:04:30 +0000 2021
1349174357290057731	Wed Jan 13 02:00:07 +0000 2021	Luis R. Sepúlveda, a Democratic New York State senator who is running for Bronx borough president, was arrested on… https://t.co/1kmlkKDHC5	108	337	0	
1349169312926461961	Wed Jan 13 01:40:05 +0000 2021	Senator Chuck Schumer, the Democratic leader, called on Tuesday for federal law enforcement officials to add the pe… https://t.co/7dhabKEigk	196	1871	0	
1349166791935799300	Wed Jan 13 01:30:04 +0000 2021	RT @xanalter: Amazon has removed the white supremacist novel ‘The Turner Diaries’ from its site. Experts say it has inspired dozens of hate…	147	0	1	Wed Jan 13 00:02:20 +0000 2021
1349163788604469250	Wed Jan 13 01:18:08 +0000 2021	Breaking News: Vice President Mike Pence rejected calls to strip President Trump of his powers through the 25th Ame… https://t.co/o04Jwv1LzA	357	1371	0	
1349161764211064833	Wed Jan 13 01:10:05 +0000 2021	The head of the Chamber of Commerce, the U.S.’s largest business lobbying group, called President Trump’s conduct “… https://t.co/L0tXto3XhR	1036	3399	0	
1349159243266588673	Wed Jan 13 01:00:04 +0000 2021	Rep. Liz Cheney, the No. 3 House Republican, said that she would vote to impeach President Trump, saying there had… https://t.co/Q3eJdFQmjV	345	2486	0	
1349156730165407750	Wed Jan 13 00:50:05 +0000 2021	RT @jimtankersley: So @arappeport and I asked @SenSanders how aggressively he was going to use reconciliation to move a Biden agenda. Unde…	396	0	1	Tue Jan 12 21:54:43 +0000 2021
1349151734304800768	Wed Jan 13 00:30:14 +0000 2021	“Trump understood that, through it all, Twitter was his to use as he pleased, writes @jwherrman. As an insurgent… https://t.co/Iah8UzSZic	137	674	0	
1349147916557033474	Wed Jan 13 00:15:03 +0000 2021	RT @Neil_Irwin: The Trump years taught us something very important: The U.S. economy can run hotter—with a stronger job market and larger f…	151	0	1	Mon Jan 11 13:44:05 +0000 2021
1349140374279905280	Tue Jan 12 23:45:05 +0000 2021	A Republican who is running for Staten Island borough president apologized on Tuesday after she said “Heil Hitler”… https://t.co/0JOwezjAcd	297	669	0	
1349137646321332224	Tue Jan 12 23:34:15 +0000 2021	Breaking News: The Supreme Court reinstated an abortion-pill restriction that requires women to pick up in person m… https://t.co/Ljly1YBlI7	332	494	0	
1349133105869762560	Tue Jan 12 23:16:12 +0000 2021	“This is how we live in Afghanistan,” said Arifa Armaghan, 29. “It is not just me. I talk to some people who say go… https://t.co/BNvJLQYlXm	42	131	0	
1349133101440630784	Tue Jan 12 23:16:11 +0000 2021	Elsewhere, people carry items that can identify them, but in Afghanistan, driver’s licenses and employee badges are… https://t.co/crUBavYvdr	23	116	0	
1349133095124008968	Tue Jan 12 23:16:10 +0000 2021	The constant threat of a sudden, brutal death has left many Afghans with a sense of despair and fatalism. Commuting… https://t.co/Jt61U9XOp0	18	46	0	
1349133089902108675	Tue Jan 12 23:16:08 +0000 2021	Masouma Tajik, a computer science student in Kabul, carries a pocket note with the phone numbers of family members… https://t.co/vKuaqWZbCq	23	45	0	
1349133084957040641	Tue Jan 12 23:16:07 +0000 2021	Tareq Qassemi knows too well how dangerous Kabul can be. “I could get killed on my way to work or in a car or anywh… https://t.co/IPaEsz7ikl	17	87	0	
1349133080653672452	Tue Jan 12 23:16:06 +0000 2021	Afghans engulfed by violence have begun carrying slips of paper known as pocket notes —  homemade, civilian version… https://t.co/wGwxDSuUus	153	442	0	
1349130300417323013	Tue Jan 12 23:05:03 +0000 2021	Tens of thousands of lives in Europe could have been saved if countries had implemented strict coronavirus measures… https://t.co/kBJQVRUU7r	162	612	0	
1349129155674320897	Tue Jan 12 23:00:30 +0000 2021	Videos show pro-Trump rioters pulling three officers down a set of stairs during a violent attempt to breach the U.… https://t.co/PMIvIAL1cf	2949	4697	0	
1349121484921446401	Tue Jan 12 22:30:02 +0000 2021	Racing against a rising coronavirus death toll, the Trump administration has ordered states to immediately begin va… https://t.co/k9NRbhLE1r	74	287	0	
1349120509917753345	Tue Jan 12 22:26:09 +0000 2021	RT @arappeport: Republicans mused for years what a nightmare it would be if Bernie Sanders chaired budget committee, jamming socialist poli…	283	0	1	Tue Jan 12 22:23:38 +0000 2021
1349115220409671680	Tue Jan 12 22:05:08 +0000 2021	Thousands of fans packed the streets of Tuscaloosa following the University of Alabama's college football national… https://t.co/kCv0IJUihE	117	412	0	
1349110172707409930	Tue Jan 12 21:45:05 +0000 2021	Rioters who participated in the attack on the Capitol may be charged with conspiracy and sedition charges, a top fe… https://t.co/Mc3ZOYBp1f	342	1957	0	
1349107443540897797	Tue Jan 12 21:34:14 +0000 2021	RT @jmartNYT: NEW: McConnell believes Trump committed impeachable offenses, believes the attack on Capitol gives Rs a chance to purge the p…	6412	0	1	Tue Jan 12 21:32:52 +0000 2021
1349106939951788033	Tue Jan 12 21:32:14 +0000 2021	Breaking News: Senator Mitch McConnell is said to believe President Trump committed impeachable offenses, and to be… https://t.co/CWUGIEzj06	7716	30767	0	
1349106587546185729	Tue Jan 12 21:30:50 +0000 2021	RT @NickAtNews: BREAKING: The U.S. attorney in D.C. says prosecutors are weighing sedition charges related to the Capitol riot and have alr…	141	0	1	Tue Jan 12 21:28:07 +0000 2021
1349103868676878344	Tue Jan 12 21:20:02 +0000 2021	In OpinionI will tell the president, Congress and the public what we know when we know it, and I will do so even… https://t.co/7QcpxorGqS	66	596	0	
1349098874116435968	Tue Jan 12 21:00:11 +0000 2021	House Democrats were briefed on Monday on specific active threats to the Capitol and lawmakers. One called it “the… https://t.co/jPIbiIwGtL	132	503	0	
1349096333345497088	Tue Jan 12 20:50:05 +0000 2021	Scientists in Brazil on Tuesday said a coronavirus vaccine made by a Chinese company was far less effective than th… https://t.co/EQqeZo0gtX	200	459	0	
1349095119643934722	Tue Jan 12 20:45:16 +0000 2021	International air travelers headed to the U.S. will first need to show proof of a negative coronavirus test before… https://t.co/DsKV5IUjq3	219	916	0	
1349093806847700994	Tue Jan 12 20:40:03 +0000 2021	As cases of the coronavirus continue to surge, football coaches, the President-elect and even some science-savvy se… https://t.co/KaWAqv7yIn	233	762	0	
1349093057262723076	Tue Jan 12 20:37:04 +0000 2021	RT @apoorva_nyc: NEW: The U.S. will require all international passengers to show proof of a negative coronavirus test result, according a n…	152	0	1	Tue Jan 12 20:24:22 +0000 2021
1349091324344086528	Tue Jan 12 20:30:11 +0000 2021	Tim Berners-Lee, who created the web three decades ago, believes the online world has gone astray and wants to put… https://t.co/ucvopbgIEL	298	1059	0	
1349089532172500992	Tue Jan 12 20:23:03 +0000 2021	Senator Chuck Schumer, the Democratic leader, called on Tuesday for the people who participated in the violent riot… https://t.co/5E5nXVOhDG	249	2109	0	
1349087767209377793	Tue Jan 12 20:16:03 +0000 2021	The death of Sheldon Adelson, who donated more than half a billion dollars to GOP candidates and causes, leaves Rep… https://t.co/oZlF31LQmU	243	1494	0	
1349085682963263489	Tue Jan 12 20:07:46 +0000 2021	RT @MaggieAstor: More Republican resignations on the Hill, including Ted Cruz's communications director. w/ @CatieEdmondson and @GlennThrus…	715	0	1	Tue Jan 12 20:00:10 +0000 2021
1349083956365418499	Tue Jan 12 20:00:54 +0000 2021	Breaking News: FBI officials sent a stark warning about the threat of violence the day before a mob attacked the Ca… https://t.co/Bk3LJVA5AD	348	1203	0	
1349079980542734337	Tue Jan 12 19:45:06 +0000 2021	CitiField, the New York Mets’ home stadium in Queens, will be a mass vaccination site starting the week of January… https://t.co/q2KCq6ofqE	173	1304	0	
1349077527227203584	Tue Jan 12 19:35:21 +0000 2021	The decision by Rep. Kevin McCarthy of California, the minority leader, constituted a subtle shift away from Trump.… https://t.co/xJkqjyMApg	150	772	0	
1349077397308649472	Tue Jan 12 19:34:50 +0000 2021	Breaking News: Making a tacit break from President Trump, House Republican leaders have decided not to formally lob… https://t.co/ol03KxAv5f	1319	5608	0	
1349076246009950210	Tue Jan 12 19:30:16 +0000 2021	Our restaurant critic @pete_wells investigates whether the single-table huts, cabins and bubbles that have sprung u… https://t.co/R6XnXCkh8x	57	230	0	
1349073680199020544	Tue Jan 12 19:20:04 +0000 2021	Michigan’s attorney general said that the state’s Capitol was still “not safe” even after a commission voted this w… https://t.co/bjZXriAUCf	186	686	0	
1349072433752526849	Tue Jan 12 19:15:07 +0000 2021	A group of former Trump administration officials and Republicans opposed to the president said they would make a $5… https://t.co/ZcuqkOZ8ok	1535	7571	0	
1349069903362478082	Tue Jan 12 19:05:04 +0000 2021	RT @pete_wells: What it's like to eat in a greenhouse, a beach cabana, a yurt and a plywood shed: https://t.co/m9hMfQnoSN	40	0	1	Tue Jan 12 16:41:32 +0000 2021
1349068670610386944	Tue Jan 12 19:00:10 +0000 2021	The populist movement that now governs Italy spent nearly a decade sowing doubts about vaccines, which may have mad… https://t.co/p2hOERrqYK	65	220	0	
1349066152190877696	Tue Jan 12 18:50:09 +0000 2021	RT @heytherehaIey: We analyzed, minute by minute, the crucial two-hour period during which a Trump rally to stop the certification of the e…	3249	0	1	Tue Jan 12 17:29:10 +0000 2021
1349065127946055681	Tue Jan 12 18:46:05 +0000 2021	Some 9,000 children died, and women and girls were subject to traumatic abuse in Ireland’s “mother and baby” homes,… https://t.co/zSFqxPjlqo	149	471	0	
1349063630680158209	Tue Jan 12 18:40:08 +0000 2021	A Trump administration official has posted a series of debunked claims questioning the established science of clima… https://t.co/3N9HZV8VLB	125	410	0	
1349061096544628736	Tue Jan 12 18:30:04 +0000 2021	An Olympic gold medalist, the swimmer Klete Keller, was part of the pro-Trump mob that sieged the Capitol, former t… https://t.co/BezHpVn8B3	4429	10477	0	
1349058598685601795	Tue Jan 12 18:20:08 +0000 2021	Organizers for far-right groups have splintered across the internet after being banned from major social media plat… https://t.co/R70evTleD7	118	306	0	
1349057521567338496	Tue Jan 12 18:15:52 +0000 2021	RT @jbouie: Discussing my @nytopinion column on Ted Cruz and Kevin McCarthy’s call for “unity” https://t.co/SebnJzWfWs https://t.co/6O805…	67	0	1	Tue Jan 12 18:11:56 +0000 2021
1349056064621334537	Tue Jan 12 18:10:04 +0000 2021	The forgotten Bitcoin passwords worth an estimated $140 billionhttps://t.co/oTqT1HAHTB	124	501	0	
1349053580133740547	Tue Jan 12 18:00:12 +0000 2021	The sergeants-at-arms of the Senate and House, Michael Stenger and Paul Irving, who both resigned last week, face i… https://t.co/MQclsle8dn	154	614	0	
1349051023298588680	Tue Jan 12 17:50:02 +0000 2021	Derek Chauvin, the fired Minneapolis police officer charged with murder in the death of George Floyd, will be tried… https://t.co/4u0aaOYSTD	95	460	0	
1349049789963493378	Tue Jan 12 17:45:08 +0000 2021	RT @LaurenLeatherby: As we reconstructed the hours before the mob broke into the Capitol, we found striking juxtapositions: lawmakers insid…	141	0	1	Tue Jan 12 15:52:43 +0000 2021
1349047480554553357	Tue Jan 12 17:35:58 +0000 2021	Representative Raskin, who drafted the article of impeachment against President Trump, is also a member of the Rule… https://t.co/Ln2mek5eBT	339	2109	0	
1349047247623880704	Tue Jan 12 17:35:02 +0000 2021	The day after his 25-year-old son’s funeral, Representative Jamie Raskin found himself hiding with his House collea… https://t.co/MDbUAqr7Cc	1929	11374	0	
1349046059436277762	Tue Jan 12 17:30:19 +0000 2021	Customs officials seized a truck driver's ham sandwich as he was entering the European Union from Britain. It’s one… https://t.co/wh9TQkvSHM	74	333	0	
1349043481117937667	Tue Jan 12 17:20:04 +0000 2021	How a presidential rally turned into a Capitol rampage https://t.co/H39jdRvkbe	508	1248	0	
1349042230980435973	Tue Jan 12 17:15:06 +0000 2021	RT @anniekarni: “Trump has made it clear he is going to try and politically punish anyone who stands against him,” said @SarahLongwell25.…	607	0	1	Tue Jan 12 17:03:27 +0000 2021
1349040972857044992	Tue Jan 12 17:10:06 +0000 2021	President-elect Joe Biden’s transition team hopes to persuade Senate Republicans to help him quickly confirm his to… https://t.co/JL9wxb6Kws	105	599	0	
1349038501019451392	Tue Jan 12 17:00:17 +0000 2021	Today's Great Read: Relics from the favorite hideaway of Caligula, ancient Rome’s most infamous tyrant, have been… https://t.co/5689kARZM7	80	344	0	
1349034682785148930	Tue Jan 12 16:45:06 +0000 2021	The Trump administration plans to release vaccine doses that had been held back and aims to make them available to… https://t.co/fLbifKN25n	81	360	0	
1349033664152293378	Tue Jan 12 16:41:04 +0000 2021	RT @migold: Three Democratic lawmakers have now tested positive for Covid-19 since the riot. All of them have pointed to Republicans who di…	120	0	1	Tue Jan 12 16:38:55 +0000 2021
1349030950009786368	Tue Jan 12 16:30:16 +0000 2021	Netflix plans 70 movies for 2021 featuring Academy Award winners and box office stars, a reminder of the streaming… https://t.co/VFBzGBIo8h	91	501	0	
1349029953174700033	Tue Jan 12 16:26:19 +0000 2021	Breaking News: President Trump showed no contrition for inciting the deadly riot at the Capitol, saying his remarks… https://t.co/nTQKHeq5T1	789	2224	0	
1349027811412086785	Tue Jan 12 16:17:48 +0000 2021	RT @cflav: For months, @LFFriedman and I have been looking into what the Trump White House sought by installing climate deniers in its scie…	91	0	1	Tue Jan 12 16:15:49 +0000 2021
1349027143351758848	Tue Jan 12 16:15:09 +0000 2021	Homeland Security officials said that enhanced security measures for President-elect Joe Biden’s inauguration will… https://t.co/maZ2Rzx7F4	127	602	0	
1349025873014489089	Tue Jan 12 16:10:06 +0000 2021	The son of a Brooklyn judge was arrested Tuesday over his role in last week’s riot at the U.S. Capitol. He faces fo… https://t.co/rrGLUum30Q	429	2596	0	
1349023424723746820	Tue Jan 12 16:00:22 +0000 2021	“It takes your breath away. The amount of knowledge they held, and connection to our past.The virus has killed N… https://t.co/lV2GW7eVbr	365	999	0	
1349019582305099778	Tue Jan 12 15:45:06 +0000 2021	If President Trump is impeached in the House and convicted by a two-thirds vote in the Senate and removed from offi… https://t.co/NDxcyXAjyk	333	1756	0	
1349018316489314310	Tue Jan 12 15:40:04 +0000 2021	Stefan Thomas has two guesses left to figure out a password that is worth about $220 million. He is one of the many… https://t.co/uE6d85cEQ7	2922	7854	0	
1349017996128350210	Tue Jan 12 15:38:48 +0000 2021	See more details, video and images of the siege on the Capitol. https://t.co/3epmcZO7pc	196	483	0	
1349017993708187653	Tue Jan 12 15:38:47 +0000 2021	After the breach— The House goes into recess after the break-in.— The crowd grows outside as attendees from Trum… https://t.co/UIwJCxR7dN	258	668	0	
1349017987538415620	Tue Jan 12 15:38:46 +0000 2021	From 2:11 p.m. - 2:16 p.m.— Rioters break into the Capitol.— As the mob nears the Senate, it is called into rece… https://t.co/Hw0MVwIGoJ	196	479	0	
1349017981347618821	Tue Jan 12 15:38:44 +0000 2021	At 2:10 p.m.— The final barrier on the west side of the Capitol is breached.— The building is surrounded by the… https://t.co/yAAVaL1538	189	555	0	
1349017932286877699	Tue Jan 12 15:38:33 +0000 2021	From 1:12 p.m. to 2:00 p.m.— Trump’s speech ends.— Outside the Capitol, the rioters’ clash with the police escal… https://t.co/jzxlyqvpP4	318	699	0	
1349015836233752581	Tue Jan 12 15:30:13 +0000 2021	In OpinionOn the latest episode of Sway with @karaswisher, Anna Wintour gives an exclusive interview on Vice Pres… https://t.co/ddLXEFhRyU	44	224	0	
1349013285870465032	Tue Jan 12 15:20:05 +0000 2021	Three police officers were killed in Puerto Rico when a carjacker opened fire at them and ran over one of the offic… https://t.co/eLHpQ7LYvq	47	216	0	
1349012051507687425	Tue Jan 12 15:15:11 +0000 2021	These are the companies and institutions that have cut ties or distanced themselves from President Trump since the… https://t.co/J1T6j9O2d0	163	677	0	
1349009508543193090	Tue Jan 12 15:05:04 +0000 2021	Two Democratic members of Congress, Rep. Bonnie Watson Coleman of New Jersey and Rep. Pramila Jayapal of Washington… https://t.co/BeJVSvlrkX	189	641	0	
1349008278014078976	Tue Jan 12 15:00:11 +0000 2021	California is setting up mass coronavirus vaccination sites, including at Dodger Stadium and Disneyland. The state… https://t.co/O9QFaGN47t	67	485	0	
1349006588259012615	Tue Jan 12 14:53:28 +0000 2021	From 1:12 p.m. to 2:00 p.m.— Trump’s speech ends.— Outside the Capitol, the rioters’ clash with the police escal… https://t.co/9ADpWMpUEu	163	452	0	
1349006477609103362	Tue Jan 12 14:53:02 +0000 2021	From 12:53 p.m. - 1:03 p.m.— Trump’s speech continues.— A crowd at the Capitol overwhelms police and breaks thro… https://t.co/xzh9DKAaFF	313	828	0	
1349006264764948480	Tue Jan 12 14:52:11 +0000 2021	From 12:15 p.m to 12:50 p.m.— During Trump’s speech, he tells the crowd to walk to the Capitol. “You have to show… https://t.co/6XEpUlM3le	389	1061	0	
1349006113547706373	Tue Jan 12 14:51:35 +0000 2021	Here’s what was happening before noon— Near the White House, Trump addresses supporters he had summoned to Washin… https://t.co/MBSBJCV28I	293	723	0	
1349005745233264640	Tue Jan 12 14:50:07 +0000 2021	As President Trump railed against the election results from a stage near the White House, his loyalists were alread… https://t.co/OVepwRkX7N	1865	4145	0	
1349004476200456194	Tue Jan 12 14:45:05 +0000 2021	U.S. State Department diplomats and staff have expressed outrage at Secretary of State Mike Pompeo’s failure to ack… https://t.co/BqrJcbBZYS	507	1776	0	
1349001953720807426	Tue Jan 12 14:35:03 +0000 2021	State and federal wildlife authorities were investigating after a manatee with “Trump” etched on its back was spott… https://t.co/YrH8RKkGUY	384	1249	0	
1349000711053455366	Tue Jan 12 14:30:07 +0000 2021	The House is poised to vote Tuesday evening to formally call on Vice President Mike Pence to strip President Trump… https://t.co/VZ465bSLf6	196	975	0	
1348999448949612549	Tue Jan 12 14:25:06 +0000 2021	RT @nytimesbooks: Sally Rooney's next book is coming in September. The novel, which follows four young people in Ireland, is part of a two-…	131	0	1	Tue Jan 12 14:13:10 +0000 2021
1348997166975561728	Tue Jan 12 14:16:02 +0000 2021	No charges will be filed against Anthony Pirone, a former transit officer involved in the fatal shooting of Oscar G… https://t.co/cN3WIVdpKa	46	169	0	
1348995582619242497	Tue Jan 12 14:09:44 +0000 2021	Breaking News: U.S. health officials will recommend giving the coronavirus vaccine to everyone over 65 in an attemp… https://t.co/bJjBFAutLS	183	844	0	
1348993190322442242	Tue Jan 12 14:00:14 +0000 2021	A federal judge issued a stay in Lisa Montgomery’s case, temporarily suspending her execution for a brutal murder.… https://t.co/QP8qvBH4M9	63	320	0	
1348990637513834497	Tue Jan 12 13:50:05 +0000 2021	Alabama ended a tumultuous season by clinching the team's 13th national championship win. More than a thousand jubi… https://t.co/RzlreN64DI	47	286	0	
1348989384209682434	Tue Jan 12 13:45:06 +0000 2021	Bill Belichick, the coach of the New England Patriots, said that he turned down the opportunity to receive the Pres… https://t.co/pdbc3gobg2	244	2156	0	
1348985693599621126	Tue Jan 12 13:30:26 +0000 2021	Andrew Yang said that his family decided to leave New York City during the pandemic in part to help his son, who is… https://t.co/Nb4YBJuvkP	18	188	0	
1348985600217645057	Tue Jan 12 13:30:04 +0000 2021	Democratic lawmakers have introduced an article of impeachment against President Trump for inciting violence again… https://t.co/Hbq03Nuu7C	88	562	0	
1348984620713463809	Tue Jan 12 13:26:11 +0000 2021	Breaking News: Sheldon Adelson, the casino magnate and billionaire donor to right-wing political causes in America… https://t.co/kPVRpREKIL	300	1065	0	
1348983090748792832	Tue Jan 12 13:20:06 +0000 2021	Several of President Trump's closest allies in Congress urged their supporters to attend the Jan. 6 rally that turn… https://t.co/WvQivTU3B6	632	1528	0	
1348980576485781506	Tue Jan 12 13:10:06 +0000 2021	A Chinese company wanted to use a smart cushion to track its employees’ health. Among other features, the cushion… https://t.co/AnqYURZD8E	73	363	0	
